
fri/uni/uros-cibej,5,"imel sem ga kot asistenta na tor1 in tor2. izredno prijazen in potrpezljiv. pred izpiti se splaca it na kaksne govorilne ker si bo res vzel cas in sel cez vsako nejasnost.

zasluzi si oceno 6, pa mu je nemorem dat."
fri/uni/uros-cibej,5,"gotovo najbolj potrpezljiv asistent na faxu, kot predavatelja ga ne poznam. za studenta si vzame cas, vsako nejasnost razlozi 10x in na 10 nacinov, ce je potrebno. vaje vodi zanimivo in jasno, ce hodis k njemu in sledis, te pripravi na izpit. po njem bi se morali zgledovati vsi zaposleni na fakulteti."
fri/uni/ana-sasa,5,she's hot.... VERY hot
fri/uni/ana-sasa,4,"Večkrat ji flomaster ali goba padeta v koš. Ko se to zgodi se vedno malo nasmeje in malo zafarba, je pa preveč fina da bi pobrala ven."
fri/uni/ana-sasa,5,"Kar lahko rečem - ima potencial, mogoče ji manjka malo kilometrine pri poučevanju, malo strogosti ji manjka. Vendar to vse pride z izkušnjami."
fri/uni/ana-sasa,5,"na vse njene vaje sm prsou pa biu v prvi vrsti!!! :D
drgac je pa lustna in full simpaticna. aja pa razlaga tud dobr... :D"
fri/uni/ana-sasa,3,"punči je lušna, ampak, ko smo jo mel enkrat na vajah nismo vedl za kaj gre, pa ful potiho govori"
fri/uni/miha-skerlavaj,5,"Teorija organizacije - Snov za povprečnega FRIjevca najbrž ni nevem kaj zanimiva, ampak vseeno profesor na zelo dober način poda snov, svoja predavanja opremi z video vsebinami in kratkim skupinskim vajami. Zna se tudi pošaliti in ima odprt odnos do študentov. Izpit se opravi s 3 poročili (""programi""), ki so nezahtevna (1-2 strani) ampak vseeno poskrbijo da študent sledi toku predavanj, na koncu je potrebno opraviti seminarsko nalogo po nekih člankih, ki so za branje bolj kot ne obup. Seminarska je malo bolj zahtevna kot poročila (10 strani analize članka, utemeljitve in umestitve. Na predstavitvi seminarske profesor konstruktivno opomni na napake in pove kako se tega v prihodnje izogneš. Ustnega ni. Overall zelo zadovoljen."
fri/uni/miha-skerlavaj,5,"Profesor zna narediti dobra, zanimiva predavanja, ki potekajo v sproščenem vzdušju. V bistvu je bila moja obiskanost njegovih predavanj 100 %."
fri/uni/damjan-sonc,4,"Naj omenim, da se Damjan Šonc in ostali asistenti ARS/ORSa trudijo predavati predmeta, pri katerima ima veliko število študentov težave. Snov je za tistega, ki se z njo spozna prvič izjemno obsežna in težka. Mislim pa, da asistent odlično pomaga študentom, do  razumevanja.
Med študenti sicer krožijo pripombe, da je snov nerazumljiva, vendar mislim, da glede na količino snovi in zahtevnost svojo nalogo odlično opravi. Z nekaj malega sprotnega dela se da vajam slediti brez težav, Damjan Šonc pa je pripravljen takrat odgovoriti na vsako vprašanje, in bolj podrobno razložiti snov. Je izjemno strokoven in o snovi, ki jo predava ve ogromno.
Zdi se mi le, da je včasih malce ""nepotrpežliv"" do študentov, ki jim snov ne gre in jo dojemajo počasneje. Nekateri so se pritoževali nad ocenjevanjem kolokvijem, sam pa nisem imel takih težav. Tudi na vpogledu sem dobil točke, saj je asistent pač napravil napako in spregledal pravilnost moje kode.
Mislim, da je Damjan Šonc super asistent, mogoče malo bolj za tiste, ki snov hitreje razumejo.
Vseeno mu dam 4/4. Od asistentov si želim več take strokovnosti."
fri/uni/marina-stros-bracko,1,"Njen odnos je tako podel, da odtehta vse drugo."
fri/uni/marina-stros-bracko,1,"Odnos do študentov pod vsakim nivojem, neresnost glede vsakih dogovorov, katastrofalen slovanski naglas, v glavnem skorajda norčevanje iz FRIjevcev, da nam dodelijo takšno ""profesorico"" angleščine.

Ker pa predstavlja mnogim FRIjevcem edini stik s FF, nas pa še dodatno napeljujejo k temu, da preziramo FF and all that it stands for ... in to nam ne bi smelo biti v ponos, ampak žal tako je."
fri/uni/marina-stros-bracko,1,"Predavanja niso nič posebno dobrega/slabega, je pa njen odnost porazen. Morala bi se malo zresnit in prihajat na govorilne ure, popravit izpite, vpisat ocene, ...
Ocenim jo z 1."
fri/uni/marina-stros-bracko,3,"Moti me samo to, da je morda poudarek na napačnih stvareh, in da je profesorica preveč raztresena in se ne drži povedanega, potem pa 

jo moraš lovit za vpis ocene in oglede. Pričakoval bi morda še nekoliko več računalniške angleščine, npr. stvari, bi ki nam prišle 

prav pri ostalih predmetih (tega praktično ni) - npr. pri APS, ARS."
fri/uni/marina-stros-bracko,1,"Zaradi vzvišenosti in arogance sem nehal obiskovat njena predavanja. Posebna misija je tudi vpis ocene v indeks, ker je izjemno nezanesljiva glede govorilnih ur. Moj izpit je bil zelo površno ocenjen. Na ogledu sem ji pod nos pomolil 2 popolnoma neocenjeni nalogi. Da ne govorim o snovi, ki je za računalničarja totalno nekoristna - npr kakšna je struktura časopisnega članka in podobne piflarske fore. Še anglež tega ne ve. Res si zasluži velik cvek. Me zanima če se tako obnaša tudi v njeni jezikovni šoli BABYLON?"
fri/uni/marina-stros-bracko,1,"Podn od podna.

Zdaj vem, da input ni pravilno tvorjena angleška beseda, ker n v angleščini ni pred p. Po pravilih bi moralo biti imput. To mi full koristi. Hvala."
fri/uni/marina-stros-bracko,1,"Na FE je edina profesorica, ki me je kdaj učila. Sej ne, da imam slabo mnenje o ženskah, samo ko sem spoznal njo, mi ga je sigurno pokvarila. Je najbol arogantna, zgubljena in tečna ženska, kar jih poznam. Druge ji ne sežejo do kolen!"
fri/uni/marina-stros-bracko,1,"Nikakor je ni možno dobit na govorilnih urah, kar me še najbolj moti. Pa še poudarek daje na popolnoma napačne stvari."
fri/uni/marina-stros-bracko,1,"Nesramna, kar je za profesorico nedopustno."
fri/uni/marina-stros-bracko,1,"Ženska ki ima resne probleme in vse funkcije ki jih opravlja so zrele za inšpekcijo - ne/popravljanje izpitov, izgubljanje izpitov,na hitro preletevanje testov in takojšnje odločanje da nisi naredil,preveč šminke,...."
fri/uni/marina-stros-bracko,1,"Zelo slab odnos do studentov. Anglescino pa vsak zna dovolj, da naredi izpit. Zdi se mi nepotrebno."
fri/uni/marina-stros-bracko,3,"Zelo težko jo je dobiti na govorilnih urah, nemogoče je od nje dobiti kakršnokoli informacijo razen na predavanjih (vajah) in še enkrat, če ne vpišeš ocene takrat ko je pisni rok, je ne boš nikoli najdel ker je stalno po evropi na teh njenih sodiščih kot prevajalka...

Dobro oceno ji dam, ker je na ustnih zelo dobra. Zviša po dve oceni. 

Vaje ima dokaj zanimive, če te zanima kaj več o svetu (dosti pogovarjanja o zadevah...)"
fri/uni/marina-stros-bracko,1,"Profesorca je za v sredno šolo, pa še tam bo koga težko kaj naučila. Izpite popravlja površno - po 3. datumu objave rezultatov končno našel svoj izpit, neocenjen in z 7 na vrhu ... edino kar jo rešuje prijave je to, da uči v prvem letniku, ko so študentje še premalo pogumni, da bi se borili za svoje pravice. Po mojem NAJSLABŠI profesor na fakulteti. (ocena je iz daljnega leta 2000)"
fri/uni/marina-stros-bracko,3,"Jaz sem na njenih predavanjih uživala. Je pa res, da je delovala zmedeno, ni prihajala pripravljena, nikoli ni vodila evidence, kaj sploh delamo. VEDNO nam je dala nalogo in vsakič je vprašala, če nam jo je dala. Rekli smo ne in s tem je bila stvar zaključena...ok potem pa ne.
Na vpogled nisem šla, ker sem pisala 8 in sem bila s tem zadovoljna, tako da nisem videla, kako ocenjuje. Je pa res, da jo je nemogoče dobit. Tudi snov je razmetana, ni gradiva in to je ful problem, ker je izbirni predmet in se marsikdaj komu prekriva, zato recimo ne more na predavanja."
fri/uni/marina-stros-bracko,1,"Slabše profesorice še v celotnem svojem šolanju nisem imel. Odnos do študentov je katastrofalen, predavanja so mimo. Odgovori na izpitu morajo biti točno kot si je zamislila. Snov na izpitu je nevmesna. Na izpitu nima ravno občutka za čas, saj je začela izpite pobirat 15min pred koncem, ko jo je študent na to opomnil je ponorela. Dokler je ona nosilka angleščine na FRI priporočam da se držite vstran."
fri/uni/marina-stros-bracko,4,"Profesorica je imela za moje pojme zanimiva predavanja, ker smo se pogovarjali o dogajanju po svetu, politiki, in raznoraznih zanimivih zadevah (recimo o bivših študentih FRIja in koliko zaslužijo v drugih državah). Izpit je precej lahek, težav s profesorico pa nisem imel... po izpitu je objavila datum za ustni izpit, kjer mi je samo vpisala oceno."
fri/vsp/marko-bajec-2,5,Odlično strukturirana predavanja.
fri/vsp/bulic,5,Dejansko eden izmed redkih asistentov ki mu je bil cilj ljudi nekaj naučit in ne grenit življenja.
fri/vsp/bulic,5,"Zelo dostopen in odprt asistent, se trudi razložiti čimbolj po domače da bi res vsi razumeli. Mogoče za koga ki že 90% snovi pozna ni tako dober ampak za ostale pa je zelo dober. Tudi fer pri ocenjevanju."
fri/vsp/bulic,4,Dejansko dober profesor.
fri/vsp/bulic,5,En med boljših asistentov na fri. Ocena vsekakor 5.
fri/vsp/bulic,5,Kar se tice njega samo ena beseda: LEGENDA!!!! :)
fri/vsp/bulic,5,Eden od najboljših profesorjev pri katerem sem imel predavanja. Predavanja so zelo zabavna in informativna. Če bi vsi tako razlagali kot profesor Bulić bi študij na fri-ju bil veliko bolj prijetna in zabavna iskušnja.
fri/vsp/janez-demsar-vsp,5,"Mislim da trenutno ni boljsega profesorja tehnicnih predmetov na VSŠ. Njegova predavanja, kot tudi skripte in način pisanja, so res vrhunska. Nekako v stilu Prirocnikov za telebane, vendar boljše."
fri/vsp/janez-demsar-vsp,5,"Človek je faca, snov predava zelo zanimivo in na predavanjih ni nikoli dolgčas. Pa ker študentje na predavanjih ne umiramo od dolgčasa si tudi kej od snovi zapomnemo. Škoda samo da demšar nima kakšnega predmeta čisto zase, ampak si samo deli semester pri UI1 z bratkom."
fri/vsp/dobnikar,1,"Njegovi ustni izpiti so sploh katastrofa. Zahteva XY definicije, ki so tudi v šestih vrsticah. Najbolj absurdno pa je da tiste definicije, s katerimi si itaq nikjer ne mores kaj dosti pomagat, folk pozabi že v parih dneh. Profesor ponavadi na svojih ustnih pomeče 3/4 folka, se pa pogosto zgodi da pomeče kar VSE, tudi tiste ki so pisali 90+ procentov. Eden najbol ne fer prfoksov na FRIju!"
fri/vsp/dobnikar,1,"Medtem ko razlaga stvari se dostikrat izgubi in potem 5 minut izmenično gleda na tablo in v skripto.Najslabši profesor, kar sem jih kdaj imel!"
fri/vsp/dobravec,5,"Osebno mi je dober predavatelj in mi je način kakršnega ima glede vaj, domačih nalog in predavanj všeč, saj če se sproti trudiš in sodeluješ lahko lepo zaključiš predmet(vsaj meni je). 5ka"
fri/vsp/dobravec,5,Odličen predavatelj ki spodbuja študente. Se vidi da ne hodi na fax samo zaradi službe ampak tudi zaradi tega da bi nas kaj naučil
fri/vsp/dobravec,5,"Osebno eden najboljših profesorjev na faksu z najbolj zanimivimi in praktičnimi predavanji/vajami na faksu. Kakor je bilo že rečeno - vidi se, da je na faksu zaradi študentov in da se trudi v njihovo korist.

Pripravljen je pomagat, če želiš znat več kot za 10 ter če imaš težje probleme. Nalogam se posveti s predlogi in razumnimi ocenami.

Več takih bi potebovali!"
fri/vsp/dobravec,4,"Soliden profsor, ki pa po nepotrebnem komplicira pri ocenjevanju laboratorijskih vaj."
fri/vsp/dobravec,3,Meni osebno se je zdelo predavanje malce premalo strokovno za faks. Drugače pa nimam večjih pripomb.
fri/vsp/fijavz,5,"Brez pripomb. Super predavanja, zelo korekten odnos, ne pretežki izpiti."
fri/vsp/damir-franetic,5,"Damir Franetič a.k.a. Šalčka, Ninđa, Mr. Too Cool for School

je dost car, dobr razlaga, ni nikol dolgcajt :)"
fri/vsp/damir-franetic,5,Meni so bile vaje za DS pri njemu kul. Bi še hodila na kakšne vaje k njemu.
fri/vsp/gustin,1,Katastrofa profesor!!!
fri/vsp/gustin,5,"ne, pri njemu ne dobi vsak 8 na ustnem, osebno sem pri njegovem predmetu OARS dobil 6 zgolj zaradi tega, ker sem bil študent pedagoške fakultete ..."
fri/vsp/gustin,5,"ne, pri njemu ne dobi vsak 8 na ustnem, osebno sem pri njegovem predmetu OARS dobil 6 zgolj zaradi tega, ker sem bil študent pedagoške fakultete ..."
fri/vsp/gustin,4,"Malo zmeden, ampak dober po duši. Predavanja so bila čisto OK, na ustnem pa vsak dobi 8."
fri/vsp/jager,5,"""A se razumemo?
Če se ....... potem lahko nadaljujemo""
pa tudi

MIT, MIT, MIT, MIT, MIT

meni osebno, ful smešna pojava:)"
fri/vsp/jager,5,"Fajn profesor, edino če nisi lih domač v linuxu ti lohk mal zateži, da se ne sme delat na nivoju tajnic:)"
fri/vsp/aleksandar-jurisic-2,1,"Boljse spati doma, kot iti na predavanje. :/"
fri/vsp/aleksandar-jurisic-2,1,Nikakvost od profesorja nenormalno dolgočasenje pri predavanjih. Ponekod od predavanja odneseš nekaj znanja pri njem pa še manj znaš xD kakor da bi izsrkaval tvoje možgane.
fri/vsp/aleksandar-jurisic-2,1,Najvecji ***** na FRIju. :@
fri/vsp/aleksandar-jurisic-2,1,"dalec najslabsi na faksu, res polom, nima pojma o tem, kar razlaga, na ustnih zatezen, skratka obup!"
fri/vsp/kononenko,3,Zadnje čase ima premalo verskega (new age) programa.:)
fri/vsp/matjaz-kukar,2,"Sam izvaja predavanja IN vaje, kar je katastrofalno. Ničesar ga ne smeš vprašat, in če tudi ga, ne dobiš zadovoljivega odgovora, tako da hitro nehaš spraševat. Nejasne vaje, nejasne domače naloge, nejasen kriterij za domače naloge."
fri/vsp/ales-leonardis,4,"ni mi všeč njegov odnos na ustnih izpitih, ker te sploh ne vpraša drugega vprašanja, če na prvega ne znaš ..."
fri/vsp/mahnic,4,"Imel sem ga pri OP1.
Predava umirjeno, njegova razlaga je zelo na mestu.
Problem je, da je folk premalo potrpežljiv in se jim ne da poslušat.

Če bi poslušali in poskušali razumeti, kaj govori, bi videli, da je dober profesor!"
fri/vsp/mahnic,5,Mahnič je CAR !
fri/vsp/mahnic,1,"Saj ne recem, ucit OP je tezko. Vendar, ce si slab programer in Mahnic je slab programer je to se toliko tezje."
fri/vsp/mahnic,1,sramota da tak profesor uči na tako ugledni fakulteti...
fri/vsp/mihelcic,1,"Mihelcic, pejd ze enkrat v penzijo!!!"
fri/vsp/mihelcic,2,"ze moj fotr ga je meu pa je biu ze tarkt zajeban... je edn od tistih k se ne more sprjaznt s svojo usodo, da bi blo pocas ze fajn da prepusti svoje delo hovelji... sm preprican da bi biu predmet VELIK bl zanimiu. vaje vem da so odlicne"
fri/vsp/mramor-kosta,3,"Bila bi čisto v redu profesorica, če se ne bi stalno motila in če se ne bi pol predavanja samo jezila ne študente, ki jih sliši le ona."
fri/vsp/mramor-kosta,1,"Bi bila OK če bi....... Ampak NI. Letos sem obupal na njenih predavanjih ze takoj v zacetku. Ni normalno da se zmotis na vsaki drugi strani ""izlockov"". Vsakic. In ja, namesto da bi predavala, svoj cas (in tudi mojega) porablja da se jezi na kvazi glasne studente. Tisto kar pa ji uspe odpredavat se mi pa tudi ne zdi pohvale vredno."
fri/vsp/polona-oblak,5,"Ena boljših asistentk. Pri vsaki nalogi najprej napiše ""recept"" kako to nalogo rešit. Super je!"
fri/vsp/bojan-orel-2,5,"-dober, sistematičen predavatelj
-faca... jaz mu, ker se rad šali, pravim cinik (pa s tem ne mislim nič slabega)"
fri/vsp/peter-peer,2,ne zdi se mi prav da profesorji prodajajo knjige ki so obvezne za predmet...ki so jih sami napisali.
fri/vsp/peter-peer,4,"Predmet ni ravno težek za predavat, tako da nimam nobenih pripomb. Izpiti so primerni."
fri/vsp/marko-robnik-sikonja,4,"Predava tako, da ga nič ne razumem.:) Je pa, kakor bolj ali manj vso Kononenkovo osebje, ZELO sistematičen. (Ima(jo) v redu sistem domačih in seminarskih nalog.) Izpiti niso pretežki, pri ocenjevanju je fer. (Pri njemu je bistveno lažje narediti izpit kakor pri Kononenku.)"
fri/vsp/ksenija-rozman,1,"Najbolj nesramna in zoprna oseba na fakulteti, ki vse svoje tegobe zvrača na študente. OBUP!"
fri/vsp/rozanc,5,Eden najboljših profesorjev na FRI-ju. S študenti se vedno poglobi v stvari ki niso razumljive in je vedno pripravljen ponoviti razlago. Na fakultetah bi moralo biti več profesorjev kot je Igor Rožanc.
fri/vsp/rozanc,5,"Eden redkih profesorjev, ki ma s študenti človeški odnos."
fri/vsp/rozanc,5,"Eden izmed takih, ki si vedno vzame čas in vedno razlaga tako vneto, kot da bi imel prva predavanja."
fri/vsp/rozanc,5,Morm rect da je igor res fajn profesor. z njim se brez problema pogovarjas in debatiras kar se tice predavanj pa nam poskusa snov razloziti z pomocjo vsakdanjih primerov in dogodkov da jo kar najbolje razumemo. res pohvale vreden profesor. definitivno premalo takih
fri/vsp/rozanc,5,Profesor predava s srcem. Študentom hoče najboljše in jim pomaga.
fri/vsp/slivnik,5,"super profesor, odlična predavanja, vzame mi čas (celo 3 ure) in razloži snov če jo kdo ne razume, ko ""odpredava"" svoje zaključi.

problem: ne mara snowborderjev."
fri/vsp/slivnik,1,"Ne vem, kaj se je z njim zgodilo, ampak letos je bil na vajah popoln gnoj. Ful bluzi in je verbalno nasilen. Pri ocenjevanju vaj je nekorekten in očitno favorizira ženski spol."
fri/vsp/slivnik,2,"Kar nekaj bluzi, in je nerazumljiv"
fri/vsp/mira-trebar,1,"nas je imela izbirni predmet na fkkt...kot oseba je ful v redu, vendar kot pedagog ni ravno jasna, razumljiva, nedvoumna. predavanja so monotona in...včasih nenavadna"
fri/vsp/ana-sasa,5,she's hot.... VERY hot
fri/vsp/ana-sasa,4,"Večkrat ji flomaster ali goba padeta v koš. Ko se to zgodi se vedno malo nasmeje in malo zafarba, je pa preveč fina da bi pobrala ven."
fri/vsp/ana-sasa,5,"Kar lahko rečem - ima potencial, mogoče ji manjka malo kilometrine pri poučevanju, malo strogosti ji manjka. Vendar to vse pride z izkušnjami."
fri/vsp/ana-sasa,5,"na vse njene vaje sm prsou pa biu v prvi vrsti!!! :D
drgac je pa lustna in full simpaticna. aja pa razlaga tud dobr... :D"
fri/vsp/ana-sasa,3,"punči je lušna, ampak, ko smo jo mel enkrat na vajah nismo vedl za kaj gre, pa ful potiho govori"
fri/vsp/skraba,5,"Super profesor. Predavanja so zanimiva, prosojnice pa odlicne. Izpiti so ravno prav zahtevni, na ustnih izpitih pa ne komplicira."
fri/vsp/skraba,5,"Daleč najboljši profesor na celi fakulteti, vključno z UNI. Njegove prosojnice so res super, na ustnih izpitih pa niti malo ne komplicira in ti še kaj razloži."
fri/vsp/skraba,5,"Glede na to koliko se je zavzel pri ustnem izpitu in mi nekatere stvari še dodatno razložil, kapo dol."
fri/vsp/skraba,5,"Tip je legenda. Čeprav se ga da dobit, da kaj ne ve (to kar razlaga)."
fri/vsp/ster,5,Super profesor! Njegove vaje in predavanja potekajo v sproščenem stilu. Profesor si res uzame čas in vsako stvar lepo razloži.
fri/vsp/ster,5,na voljo so seveda tudi negatorji :D
fri/vsp/jure-zbontar,5,Eden najboljših asistentov.
fri/vsp/jure-zbontar,5,Res super asistent. Popolnoma brez pripomb.
fri/vsp/jure-zbontar,5,"http://www.sciencemag.org/content/331/6018/698.full?sid=a996e628-5efe-41f3-ac37-e59957bc04c9

ta link o njegovi genialnosti. defenitivno top 3 med asistenti"
fakulteta-za-socialno-delo/uni/sreco-dragos,3,dolgočasno predavanje
fakulteta-za-socialno-delo/uni/jana-mali,5,"Razumljivo in z navdušenjem predava. Odprta je za mnenja študentov, jih spoštljivo posluša in komentira."
fakulteta-za-socialno-delo/uni/jana-mali,5,"Prof. Mali je ena najboljših predavateljev na Fakulteti za socialno delo, ima dober pristop kar se tiče pedagoškega dela in odličen, pošten odnos do študentov. Potrebovali bi več takšnih profesorjev na FSD..."
fakulteta-za-socialno-delo/uni/jana-mali,5,"Prof. Mali je ena najboljših predavateljev na Fakulteti za socialno delo, ima dober pristop kar se tiče pedagoškega dela in odličen, pošten odnos do študentov. Potrebovali bi več takšnih profesorjev na FSD..."
fakulteta-za-socialno-delo/uni/bernard-stritih,5,"Pogrešam njegova fantastična predavanja, ki jih je izvajal na FSD!"
fakulteta-za-socialno-delo/uni/bernard-stritih,5,Berni je zakon!
fsp/uni/edvin-dervisevic,5,"Če bi bili vsi ljudje tako dobri kot on, potem bi bilo življenje zelo enostavno. Ali se najde kdo, ki mu bi dr. Dervišević odrekel pomoč? Poleg kvalitet pedagoga je tudi Človek!"
fsp/uni/edvin-dervisevic,5,"Car, zveš miljon stvari, vidš posnetke, slišiš stvari iz prakse, je pa res da ga eni ne štekajo, sam nimam teh problemov."
fsp/uni/dolenec,5,"od vseh profesorjev za atletiko je dolenec najbolš. je v easy, se zna pohecat."
fsp/uni/dolenec,5,Legenda!
fsp/uni/doupona-topic,2,Kot mnogi na tem faksu iz svojih predmetov dela celo znanost. Kot da bi se brez njih svet nehal vrteti.O ocenjevanju pa ne bi izgubljal besed. Napišeš definicijo iz njenih knjig pa niso prave...
fsp/uni/doupona-topic,5,"Nejka, popolnoma se strinjam."
fsp/uni/doupona-topic,5,"dr. Doupona je izjemna na področju nacionalne identitete, športne identitete, področju žensk v športu in še čem... Zelo se trudi da je pravična in zelo dobro argumanita svoje strokovne odločitve... Za razliko od nekaterih išče znanje! Skratka vse dobro o njej. Če pa je nekdo dober, se pa razume da mu ljudje kaj očitajo in mečejo polena pod noge! S tem se slovenceljni že od nekdaj napajajo... Da sam sebe ""dvigneš"" - potlači drugega!"
fsp/uni/doupona-topic,1,"Ne bi sploh govoril, kako je Doupona nezakonito prišla do mesta redne profesorice. Navadna sramota."
fsp/uni/zoran-jarnovic,1,"Od nepedagoškega delavca do asistenta ""eksperta"" za boomerang, nato masažo, nato informatiko... Kaj bo sledilo?

Komu bi ta boomerang moral prileteti nazaj v glavo?"
fsp/uni/zoran-jarnovic,1,"Groza, popolna nestrokovnost vsaj kar se tiče informatike v športu..."
fsp/uni/jernej-kapus,5,Najboljši!
fsp/uni/kapus,3,šel v pokoj
fsp/uni/damir-karpljuk,5,"vedno dostopen študentom
človeški!!!
damir = car"
fsp/uni/leskosek,1,"* Slabe pedagoške sposobnosti.
* Nespoštljiv do študentov ( gledanje v računalnik med pogovorom, itd. ).
* Na izpitih išče neznanje in je zelo strog.
* Vprašanja na izpitu so težka in specifična (ne vem zakaj so še poleg tega potrebne minus točke? ). 
* Snov je, za večino, že sama nezanimiva on jo pa naredi še bolj nezanimivo.
* Vliva strah ne pa razumevanje in znanje.

* itd.

...ne bi rada preveč grdo o njem govorila, sam upam, da on ve oz. mu kdo pove, da je naslabši pedagog na naši fakulteti. 

Mam že izpit narejen, sam sem porabila 3x več časa in živcev zaradi njega, kot pa pri drugih izpitih/profesorjih. Se splača it na kakšna predavanja na drugih fakultetah.

Srečno"
fsp/uni/leskosek,1,"Če bi bil ta predmet v prvem letniku fakultete za šport, kar bi sicer lahko bil... bi večina obupala s to fakulteto!

*****Zakaj minus točke? ...sej je pa tako izpit sestavljen, da nimaš kej bluzit, zakaj je treba pol ocenjevat neznanje?

Veliko sreče vsem pri opravljanju tega izpita! Res je po nepotrebnem najtežji izpit na fakulteti."
fsp/uni/leskosek,1,"Ne vem kaj sploh dodati:( iščem pozitivne stvari ampak jih enostavno ne najdem pri tem predmetu. Na krato opisano bi lahko rekel, da je odličen primer česa si profesor na predavanjih ne sme privoščiti in bi si morali bodoči predavatelji ogledati kako se ne predava. Naj izspostavim, samo nekaj stvari, kot so zastarel način predavanja ne sprašuj, če imaš vprašanja so zato vaje ne pa predavanja, kar ne bomo uspeli narediti na predavanjih boste na vajah... poleg tega so tukaj nejasna navodila, ki jih večina enostavno ne razume, ker se ne pove kaj konkretno je cilj njegovega predmeta. Da ne omenjam sploh njegovega odnosa doštudentov, ki je ponižujoč in na trenutke tudi zasmehujoč."
fsp/uni/leskosek,5,"Saj zato je pa še zmeraj docent. Pojma nima ne o statistiki, ne o poučevanju."
fsp/uni/stanislav-pinter,3,Prijazen
fsp/uni/stanislav-pinter,5,"po mojem mnenju je eden redkih, če že ne edini, ki poosebljajo lik ""športnega pedagoga"" na fakulteti."
fsp/uni/stanislav-pinter,5,"Zdi se mi zelo dober profesor, saj je objektiven, stvari pove jasno in razumljivo, ce je potrebno zadevo popraviti, bo to povedal in se zelo trudi pomagati studentom do dobrih ocen in se trudi pri resevanju studijskih tezav v povezavi z urnikom in podobno."
fsp/uni/borut-pistotnik,1,"Uči izrazoslovje v športu, ni pa še dojel, da se ne reče repetitivna moč ampak vzdržljivostna moč oz. vzdržljivost v moči. Pa mišičnemu krčenju reče napenjanje. Pa razlaga da izometrična kontrakcija povzroči večjo napetost v mišici kot ekscentrična. Pa za njega je pliometrija ekscentrično krčenje in ne ekscentrično koncentrična kontrakcija... Pa lahko bi našteval v nedogled. Pistotnik pojdi v srednjo šolo in se nauči malo slovenščine, pol pa pojdi še malo k Strojniku na predavanja pa se nauči še malo o živčno mehanskih osnovah, pol pa pojdi še na predavanja o anatomiji pa se nauči katera gibanja se lahko v katerem sklepu izvajajo... Taki ljudje imajo naziv izredni profesor. GROZLJIVO"
fsp/uni/borut-pistotnik,1,"Čas je, da se premakne v pokoj ali pa nauči slovenskega jezika. Tip se vtika v slovnico seminarskih nalog. Ne bi rekel, če bi bili popravki točni. Pa niso!!! Uči napačno slovenščino.

Popolnoma ponori, če rečeš ""Roke damo v predročenje"", ker češ, da je to narobe in bi moral reči samo ""priročenje"". Potem pa gledaš slovenski pravopis in SSKJ in ugotoviš, da imaš prav in on narobe. Groza.

Pa to ni vse, takšnih glupih reči je še ogromno, recimo zgornje okončine so zanj gornje okončine ... 

Baje, da ima doktorat. Le kdo mu ga je dal?"
fsp/uni/borut-pistotnik,1,"Slab profesor, ker svojih zahtev ne podaja tocno in razumljivo. Prav tako rad komplicira tudi statusnikom zaradi pristonosti in tudi pasivne prisotnosti na vajah, kjer prakticnega dela ne ocenjuje."
fsp/uni/marko-pocrnic,1,"A je kje delal kot uspešen trener ali je enako ""uspešen"" kot njegov mentor dr. Verdenik? 

Kako lahko nekatere praktične predmete vodi nekdo ki se v praksi ni izkazal vsaj s povprečnimi rezultati vsaj v kakšnem drugoligašu?

Rokomet vodijo učitelji ki so vsi po vrsti trenerji. Nogomet, košarko pa teoretiki :(

Saj ne rečem da teorija ni pomembna ampak..."
