
fmf/uni/sasa-prelovsek-komelj,4,Zelo v redu in dostopen odnos do studentov. Nimas zoprnega obcutka kot pri enih dolocenih FMF superherojsih da imajo hud vecvrednostni kompleks.
fmf/uni/sasa-prelovsek-komelj,1,"Mene je imela pri vajah iz Fizike 1 (star program) in je bila čista zmeda od asistenkte. Posiljevala nas je z homogeno in parcialno rešitvijo diferencialne enačbe, ko skorajda nismo vedeli, kaj je to diferencialna enačba."
fmf/uni/tomaz-prosen,2,"Pri Verjetnosti v fiziki razume snov, ki jo razlaga, vendar je za študente prehiter (v smislu, da misli, da vse že od prej vemo) in nima dobrega pedagoškega pristopa. Ne zaveda se, da študent na začetku drugega letnika še ne pozna vseh možnih numeričnih metod, težjih funkcij ter podobnega in zato precenjuje predznanje. Vendar ker ima predmet prvič, je še dovolj prostora za napredek."
fmf/uni/tomaz-prosen,1,"Obupno. 300 besed na minuto, pa še ti sploh ni jasno o čem govori. Ni neke rdeče niti al sistematike. Tudi če opazi da ljudem ni nič jasno, se ne potrudi kaj dosti bolj."
fmf/uni/tomaz-prosen,4,"Na merilni tehniki nas je ucil matematicno fiziko in matematicno fizikalni praktikum. Pri obeh predmetih je bil izredno profesionalen, zelo korekten odnos do studentov, ne ocenjuje prevec strogo. Pac, vse izpelje in eksaktno razlozi. Ocena: 4"
fmf/uni/tomaz-prosen,4,"Na predavanjih govori tiho in nerazumljivo, z nizkim glasom, vedno v istem tonu. Kot mentor pri domači nalogi pa se je izkazal odlično."
fmf/uni/tomaz-prosen,5,"Dober pedagog! Razume kaj pomeni podajanje snovi na nivoju študenta, ki znanje prejema in se z novo snovjo prvič srečuje."
fmf/uni/martin-raic,5,"Če je X zvezno porazdeljena, ena točka ni nobena."
fmf/uni/martin-raic,4,"Zelo specifičen tip profesorja. Zelo muhast, na trenutke zelo strog, na trenutke zabaven. Ponavadi piše zelo hitro na tablo, da komaj slediš. Rad vidi, da študentje sodelujejo, kar je zmeraj fino."
fmf/uni/anton-ramsak,5,Boj se račke.
fmf/uni/anton-ramsak,5,Zabaven profesor!
fmf/uni/anton-ramsak,5,Super profesor!
fmf/uni/anton-ramsak,5,"odlicen predavatelj, ki se trudi, da bi bilo studentom razumljivo, kar predava. in dejansko je razumljivo."
fmf/uni/anton-ramsak,5,"Predava dokaj sistematično, včasih malo prehitro. Sicer pa zelo zanimivo in razumljivo. Še posebej so mi všeč njegovi eksperimenti in način kako se poveže s študenti. Super profesor!"
fmf/uni/anton-ramsak,4,"Dokaj zmeden. Res je potrebna popolna študentova koncentracija, če želi ustvariti dobre zapiske. Ker prof. nobenega komentarja ne zapiše na tablo, tudi (pre)večkrat pride do nejasnosti/napačnih interpretacij tega kar je povedal... Je pa zelo dostopen, spodbuja spraševanje, zelo rad bi stvari razložil razumljivo. To je njegov velik plus. Sicer pa pač eden tistih profesorjev, ki pričakuje, da študentje znanje za njegov predmet pridobivajo tudi z branjem (dobro določene) literature doma. O tem ali je to dobro ali ne, ali vam to ustreza ali ne, pa naj presodi vsak zase. ;)"
fmf/uni/anton-ramsak,4,"Meni se je zdelo, da je čisto zmeden. Na listu ima napisan seznam enačb, ki jih mora v uri izpredavati. Tega ne naredi, saj celo uro govori, kaj bi moral izpeljati in pokazati."
fmf/uni/anton-ramsak,3,Blefer na deseto potenco!
fmf/uni/tomaz-rejec,5,nimam besed.
fmf/uni/pavle-saksida,5,"Ena velika dobričina. Zanimiva predavanja in vmesne izjave - npr. ""Ne me danes lovit na tipkarskih napakah, danes delam boljše napake, delam vsebinske napake."""
fmf/uni/pavle-saksida,5,"res zelo dobrosrčen profesor, včasih kar preveč.
mislim, da sem njegova predavanja sem obiskoval predvsem zarad njegovega humorja, praktično vsako uro prbije kej duhovitega.
predavanja pa so čisto kvalitetna."
fmf/uni/janez-seliger,5,Eden izmed boljših profesorjev. Vedno si je vzel čas za govorilne ure in razložil če kaj iz predavanj ni blo jasno.
fmf/uni/janez-seliger,5,Teddybear.
fmf/uni/janez-seliger,5,"Profesor, ki bi ga vsak študent fizike želel za dedka."
fmf/uni/janez-seliger,5,"Zelo prijazen profesor, tudi na hodniku vsakogar zelo lepo pozdravi."
fmf/uni/janez-seliger,5,"Super predavatelj, pri kateremu študentu res ne more biti dolgčas. Vsako snov popestri z zelo nazornimi eksperimenti. Vedno je pripravljen razčistiti vsako nejasnost. Tudi izven predavalnice vse lepo pozdravlja pa vedno se smehlja :D
Ne manjka pa nam kurje kože ko pobriše tablo s suho gobo :)"
fmf/uni/janez-seliger,5,On je raziskovalec in pedagog. Redke so te kombinacije.
fmf/uni/janez-seliger,3,"Govori prepotiho. Celo v VFP je bila gužva, ker smo vsi hoteli sedeti v prvih treh vrstah, da smo ga sploh kaj slišali."
fmf/uni/gregor-skacej,5,"Super asistent. Se mi zdi, da se od vseh najbolj trudi in vlaga največ energije v to, da bi res dobro razložil snov na vajah. Podrobno interpretira vse rezultate, da je res jasen fizikalni pomen, ne da ""nekaj smo pač zračunali. ker se da."""
fmf/uni/gregor-skacej,4,Na vajah deluje rahlo nemirno. Drugače je pa dostopen in se da lepo it na govorilne.
fmf/uni/gregor-skok,3,"Evo, da naredim čakajočemu profesorju veselje in dodam komentar.
Tuhtamo in tuhtamo... in se mamo fajn!"
fmf/uni/jaka-smrekar,3,"On je vedno tako dobre volje in tako pristno navdušen nad vsem svetom in samim sabo, da se kar nalezeš. Ni slab asistent, ampak predvsem pri teoretičnih razlagah mu zna bit težko sledit."
fmf/uni/jaka-smrekar,5,"Najboljši asistent in podajalec snovi, kar sem jih srečala. Vzame si čas za razlago vsakega primera, če je treba celo na več različnih načinov, saj na snov gleda iz različnih zornih kotov. Si pa res vzame čas tudi pri popravljanju kolokvijev."
fmf/uni/jaka-smrekar,5,"Vidi se, da mu je matematika blizu in jo poskuša približatu tudi študentom, vaje so zato dobre, vendar včasih počasne. Vsako vprašanje poskuša obširneje razložiti, vendar včasih razlage ne dojameš. Prizna, ko se zmoti, pri popravljanju kolokvijev pa 'do božiča' lahko resno pomeni, da bo popravljeno šele dan pred tem."
fmf/uni/jaka-smrekar,4,"Zelo dober asistent. Razlaga razumljivo in zanimivo, vidi se da se trudi, vendar je razlaga včasih prehitra. Če mu sledi 5 ljudi v razredu potem pozabi na nas, ki ne razumemo. Za popravljanje kolokvijev si pa res vzame čas :)"
fmf/uni/jaka-smrekar,3,"Snov podaja razumljivo in na zanimiv način. Predolgo popravlja naloge (1 mesec +), zato slabša ocena."
fmf/uni/jaka-smrekar,5,"Človek se izredno trudi. To mu uspeva, saj je (glede na komentarje starejših letnikov) vsako leto boljši. :)"
fmf/uni/jaka-smrekar,1,"Izpite popravlja do dva meseca.Zamuja na predavanja, govorilne ure. Točnost mu je tuja.  Da popravi seminarske naloge tudi traja. Negativna ocena v vseh pogledih."
fmf/uni/janez-stepisnik,5,"Ima najbolj sanjski poklic - ""predavatelj"" za Fizikalni Praktikum I. To si želim biti jaz, ko bom velik."
fmf/uni/strle,5,"Ima toliko energije, kot bi bil na prepovedanih poživilih. Na predavanjih se je res redko zehalo. Rahlo motijo edino maratonsko dolgi ustni izpiti..."
fmf/uni/strle,5,"Od njegovih predavanj lahko veliko odneseš, saj res dobro razlaga in pri dokazih res dobro razloži, kaj hočemo dokazati in naredi res cel dokaz, ne pa tako kot nekateri, ko polovico korakov vmes spustijo.
Na ustnem izpitu si res dolgo, ampak meni to ni bil problem, saj je tako prijazen in potrpežljiv, da tisti čas kar hitro mine... Na ustnem izpitu če česa ne znaš, ti pomaga, da tisto stvar dojameš."
fmf/uni/janez-strnad,5,"Gospod je taka legenda, da pravzaprav nisem vreden, da pišem komentarje o njemu."
fmf/uni/janez-strnad,5,"Če sem užival na kakšnih predavanjih, sem pri gospodu profesorju Strnadu. Težko pa razložim, kaj je bilo tisto, kar me je pritegnilo."
fmf/uni/janez-strnad,5,"Če bi mi on ukradel kolo, bi bil vesel in ponosen. Rispekt"
fmf/uni/daniel-svensek,5,Moj vzornik. <3
fmf/uni/daniel-svensek,5,"Na vajah se zaradi izogibanja številk študent hitro nauči direktne izpeljave, in pozabi na vstavljanje številk v enačbo, preden je to potrebno, kar zelo prav pride na kolokvijih. Ima nek svoj posben karakter, za moje pojme prava definicija zabavnega fizika :).

Še največ o njem lahko povejo njegove izjave...
http://www.fmf.si/izjave/"
fmf/uni/ales-vavpetic,5,"Super asistent za analizo, z zelo dobro razlago. Blo ga je zakon poslušat pa tudi karkoli in kadarkoli si lahko vprašal, res si je vzel čas."
fmf/uni/ales-vavpetic,5,"Super asistent. Zelo dobro razlaga. Prav tako je dosegljiv za govorilno uro in zelo prijazen, res se potrudi da razumeš."
fmf/uni/ales-vavpetic,5,"Res odličen asistent, zelo dobro razlaga in vedno je na voljo za govorilne ure."
fmf/uni/ales-vavpetic,5,"po vseh teh letih še vedno moj najljubši asistent! super razlaga, zelo prijazen in vedno dostopen. res je faca, tut na mafijskem pikniku je bil vedno za žur.
si zaradi njega včasih zaželim spet hodit na vaje iz analize 1 :)"
fmf/uni/matjaz-vencelj,5,"Prvi clovek, ki mi je razlozil razliko med tokom in napetostjo. Zavzet asistent, ki res nazorno in ultra simpl razlozi tista vprasanja, kjer te drugi vedno znova peljejo zejnega cez vodo. Ker ne razumejo. Vsec so mi bile ""insightful"" korespondence med fiziko in elektroniko."
fmf/uni/matjaz-vencelj,4,"Eh, naj ze napise tista skripta, pa mu dam pet. :I"
fmf/uni/matjaz-vencelj,4,"Vaje so zanimive za tiste, ki obiskujejo in sledijo predavanjem. V nasperotnem je premalo uvoda vsakic, da bi se ujel. Ce nimas casa hodit na vaje, tezko resis njegove teste, eni delajo po desetkrat... do absolventa in se cez.."
fmf/uni/matjaz-vencelj,1,"Izpeljuje stvari iz zraka, uporablja metodo ""sokoljega pogleda"", brez da bi slušateljem povedal kako je prišel do rešitve...sistematike pri vajah ni.
Dejansko vaje in predavanja pri elektroniki potekajo na tak način, da profesor in asistent študente vržeta v vodo - kdor splava, splava. Kdor se utopi, hodi na izpite in se mu ta predmet vleče do diplome."
fmf/uni/marko-zgonik,1,"Zame najbolj obupen profesor na tem faksu. Z njim ni normalnega dialoga, vedno hoče, da mu odgovoriš tisto, kar si je on v svoji glavi zamislil. Tako dolgo bo vrtal vate, dokler mu ne boš točno tistega povedal pa čeprav sploh ni pomembno ali je celo izven konteksta. Če ti ne rata ugotoviti, kar bi želel, da mu poveš, je užaljen kot mali otrok. Upam, da ne bodo nikoli več pustili voditi seminarja 4. Pri praktikumu pa sem pri njemu skoraj izgubil voljo do fizike."
fmf/uni/marko-zgonik,1,"Teme seminarjev nimajo večje povezave s predmetom, strinjam se z vsemi prejšnjimi komentarji o odnosu do študentov, enostavno zgubi živce zaradi tega, ker ne poveš točno tistega, kar si zamisli (in nima nujno veze z vprašanjem) s tistimi besedami, s katerimi si to stvar zamisli. Potem ti da lekcijo o tem, kako si lahko tam in kako si grozen študent. Na vprašanja odgovori tako, da ti ponovi vprašanje, odgovori nekaj elementarnega, kar je vsem jasno in potem ti razloži da si neumen ker tega nisi že vedel, če vrtaš naprej in želiš dobiti odgovor na to, kar si ga vprašal, v večini primerov ne zna (ker ne piše v knjigi točno tistega vprašanja). Veliko povdarja, da naj se sprašuje, a nikoli ne odgovori na vprašanja in s tem mu stopiš na ego in imaš probleme na ustnem izpitu. Pri predavanjih prepisuje iz knjige, velikokrat se zmoti in na koncu ure pusti študentom da sami odkrijejo napako. Če ga pa sproti popraviš, s tem žališ njegov ego in imaš probleme na ustnem. To je daleč najslabši profesor, od vseh, ki so me poučevali!"
fmf/uni/marko-zgonik,1,Zelo neprimerno in poniževalno obnašanje do študentov.
fmf/uni/marko-zgonik,1,"Videl samo enkrat v življenju, ko mi je ""vpisal"" oceno v indeks...pardon. Poštemplal indeks. 

Poleg Stepišnika ima dream job. Štempla ocene za praktikum 2."
fmf/uni/marko-zgonik,2,"Se strinjam z zgornjimi komentarji.
O snovi ima v glavi zapisane neke stavke in če hočeš dobro oceno jih moraš ""TOČNO"" ponoviti, sicer te bo zajeb**** zaradi neumnosti, dokler ne poveš kar hoče slišati. Ni važno koliko razumeš, temveč koliko korektno se znaš izražati.
Če ga kaj vprašaš o snovi, te najprej napiz**, nato ti odgovori tako, da ti je jasno še manj.

Seštevek
------------------------------
= bolje da se učiš doma iz knjige
= in to korektno"
fmf/uni/marko-zgonik,1,"Grozljivka. Pri seminarju se stalno oglaša z random vprašanji in komentarji v stilu 'čemu to zdaj služi' in 'kaj želite s tem povedati, saj nikomur ni nič jasno!'. Ko mu študent skuša odgovoriti postane nejevoljen in prepirljiv, sošolka je pol seminarja preskočila ker je bil tako tečen in se mu je vse zdelo brez veze. Očitno je pravi kriminal da študent v mesecu ali dveh pisanja seminarja ne postane pravi ekspert ki bi znal odgovoriti na vsako stvar ki si jo on zamisli. 
Ni mi jasno kako ga še niso odnesle ocene anket študentov, še nikogar nisem slišala da bi imel kaj lepega povedati o njem, ljudje ki ga imajo pri praktikumu menda celo obupujejo. Torej, vase zagledan profesor ki to ni, res me čudi zakaj sploh uči, morda je grenjenje življenja ljudi na zagovorih seminarjev/praktikumov/diplom/doktoratov njegov dream job."
fmf/uni/primoz-ziherl,5,"Izjemno pedagoško delo. Razumljivost in nazornost razlag presega veliko večino profesorjev FMF. Eden redkih, ki se dobro zaveda pomena načina predstavitve teme, pomena vzbujanja zanimanja poslušalcev. Sproščen a obenem spoštljiv odnos do študentov.
Zgodi se, da v razlagateljski vnemi nekoliko zaide s teme."
fmf/uni/primoz-ziherl,5,"Zna s studenti vspostaviti stik. Je odkrit in prijazen... dinamicno poucuje in je vedno zanimiv.

Mogoce vcasih pricakuje malo prevec od nas :D...

super pac"
fmf/uni/primoz-ziherl,5,"Res LEGENDA! Najboljši pedagog. Ima zmožnost ustvarjanja ""dobrega barvnega ter intenzitetnega kontrasta"" pri predavani snovi. Študentu postane jasno, ne le kaj, ampak tudi kako in zakaj. Močno izpostavlja pomembne stvari."
fmf/uni/primoz-ziherl,5,"Zna motivirati študente, pristopiti do njih, zelo dober mentor. Izjemno dobro razloži snov, če bi on predaval trdno namesto Prelovška, bi bil to najbolj priljubljen predmet."
fmf/uni/primoz-ziherl,5,"Odličen predavatelj in pedagog! Predavanja so bila zanimiva zaradi njegove posebne energije in živahnosti. Kot biolog imam fiziko le kot splošni predmet ampak, so mi bila predavanja iz fizike od vseh strokovnih predmetov še najbolj všeč (čeprav mi fizika ni posebej ljuba:)."
fmf/uni/primoz-ziherl,5,"O njem ne morem reči nič slabega, res. Izjemen fizik, ki zna tudi najbolj zapletene stvari narediti preproste. Super predavanja, podprta z obilo eksperimentov. Zna vključiti študente in jih spodbuditi k razmišljanju, trudi se fiziko povezati z vsakdanjim življenjem. Predavanja imajo rep in glavo; vsako predavanje se začne s kratko ponovitvijo prejšnje snovi, na koncu sledi kakšen primer za razmislek. Tudi ocenjuje pošteno in ima dober odnos s študenti, ni vzvišen in vprašaš ga lahko res karkoli."
fmf/uni/primoz-ziherl,5,"Ma dobr smisu za humor. Pa hud stil. Velikrat se uprašam, kje model črpa energijo, ker mi deluje res poln življenja."
fmf/uni/primoz-ziherl,4,"Kolegu, ki je posredno kritiziral Turbo Rudija pri EMP [lani], sporočam, da je Primož takrat vedel, da se bo Rudi vrnil in bo vse skupaj dal v 7. prestavo. To pojasni, zakaj si je na začetku po mojem mnenju vzel veliko časa, da je pojasneval osnove."
fmf/uni/primoz-ziherl,4,"Spomnim se njegovih lanskih fenomenalnih predavanj(vsaj lansko leto) elektromagnetnega polja, ko je nadomescal prof. Podgornika prvi mesec. Letos pa me je nekoliko razocaral z predavanji mehanike kontinuumov. Zdi se mi da se mu mnogo prevec mudi."
fmf/uni/jure-zupan,3,"Govori počasi, piše mikroskopsko majhno in fonta ne poveča na nobeno prigovarjanje. Na začetku semestra ni kazal pretiranega interesa za dodatno razlago, a proti koncu se je malce bolj 'razživel' in povedal tudi kaj o ozadju eksperimenta, iz katerega je bila naloga. Rabi še nekaj časa, da bo na vajah vsaj približno tako dobre volje kot na kakšni govorni oddaji o fiziki."
fmf/uni/jure-zupan,5,"Bravo. Koncno nekdo dobro in sistematicno uci teorijsko fiziko.
Smo ze siti starejsih teoriji priucenih raziskovalcev, ki jim sola dol visi."
fmf/uni/tomaz-zwitter,5,Tematika super. Razlaga enkratna. Dinamika učnih ur izredna. Delovno okolje slabo. Privoščil bi mu manjši observatorij.
fmf/uni/tomaz-zwitter,3,"V prvem letniku je super. Dobro predava, dokaj koherentno, skripta je v redu, predavanja zelo popestri z zabavnimi pripombami in šalami. V tretjem letniku veliko razočaranje. Snov sama po sebi je dosti manj zanimiva,hitrost govorjenja izredna, da si težko uspeš delat koristne zapiske, še posebno ker predava ob prosojnicah na projektorju,ki so precej nekoristen zlepek random strani iz raznih člankov, knjig, drugih predavanj...Če zgubiš  koncentracijo za 5 sekund se težko pobereš. In ko dobesedno do pike natančno ponovi vse šale in smešne komentarje iz prvega letnika, da ugotoviš, da jih ima v bistvu na pamet naštudirane, stvar deluje rahlo bedno, ne več smešno. Res škoda, ker v prvem letniku so bila njegova predavanja ena najzanimivejših."
fmf/uni/andrej-cadez,3,"Dober odnos do študentov, zna vredu razlagat, ampak obupno nesistematičen. Kar skače s teme na temo, pa naprej pa nazaj, ene teme ostanejo kar odprte in pozabljene..iz takih zapiskov se je blazno težko učit...nimaš pojma kaj sploh moraš znat"
fmf/uni/andrej-cadez,5,"Profesor pri predmetu astronomija.
Vidi se, da je to glavni del njegovega življenja. Predavanja so zato predstavljena v obliki profesorjevega splošnega znanja, kar ustvari prijetno interaktivno vzdušje. Njegova domačost s predavano snovjo omogoča študentu poglobljeno razumevanje snovi, le ta postane domača tudi študentu samemu.
Predavanja vedno vsebujejo tudi zgodovinsko ozadje, takratno razumevanje novih odkritij, načini in interpretacije.

Profesor je je še iz ""stare šole"", kar se vidi pri veliki zahtevani količini znanja pri študentu. Ta lastnost se mu seveda lahko šteje le v plus.

Veselijo me spontane, tudi enourne debate, ki se razvijejo po predavanjih pri odgovorih na vprašanja študentov."
fmf/uni/andrej-cadez,5,"Res super profesor ki epsko razlaga stvari, velikokrat zaide s teme in si vzame čas za vsako vprašanje. Zelo prijazen, tako kot Seliger vsakogar lepo pozdravi na hodniku.
Žal ti kdaj vzame voljo do življenja s kakšno brutalno izpeljavo, problem nastane tudi ko se moraš teorijo sam naučit - zapiski so, kot je že izpostavil nekdo zgoraj, zaradi načina predavanj nesistematični in neuporabni.
No pa saj se da :) upam da uživa v penziji!"
fmf/uni/andrej-cadez,4,"Njegova predavanja so mi bla dost všeč in se mi zdi da jih je vedno znal narest zanimiva.
Na izpitu je pa dost težek. Morš res kr ornk znat zadeve - veliko več kot jih je na predavanjih. Tist kar je mene sprašval sm mel samo to srečo da sm ravno kak teden pred izpitom pri enem drugem predmetu tisto ornk obdelal. Drugače nebi vedel."
fmf/uni/miran-cerne,5,Js mu dam čisto 5ko tako nekako
fmf/uni/martin-copic,5,Se trudi vendar ni rojen pedagog.
fmf/uni/martin-copic,4,Odnosno.
fmf/uni/martin-copic,5,No kolk jee!!!
fmf/uni/martin-copic,4,"Za trud dobi 5, za pedagoške sposobnosti pa malo manj. Na govorilne ure raje ne računajte saj človek dobi občutek da ne ve kaj ga študent vpraša, ali pa mogoče tako odgovori ne znaš izbrskat odgovora na svoje vprašanje. Mislim da se nekako ne zna spustit na nivo znanja študenta drugega letnika in iz tega nivoja razložit kar ti ni jasno."
fmf/uni/martin-copic,3,"Zelo prizadeven profesor, ki pa pedagoško ne dosega zadovoljive ravni. Deluje kot pravi pustolovec. Btw. nekdaj je bil hardcore alpinist. Spredaval je potrebne stvari in tudi napisal kvalitetno skripto. Pri njem sem manj odnesel iz predavanj, vendar se je s prizadevnim delom vse dalo nadoknaditi doma. Zaradi dobrega odnosa mi je ostal v dobrem spominu. Iz tako malega prostora je pač težko dobiti kompetentne ljudi, ki so tudi obdarjeni s pedagoško žilico."
fmf/uni/martin-copic,5,"Ko gledam nazaj na moj študij, moram pri njem malo vzdihniti. Imel sem še precej slabše profesorje. Dal mu bom 5 samo zato, ker je prijazen in ker je napisal skripto. Pa zato, ker prizna, da nima najbolj urejenih predavanj. Poleg tega se zna tudi znanstveno pogovarjati, tj. kulturno in spoštljivo, hkrati pa pri sogovorniku ne špara resnosti, ko je treba nekaj povedati po resnici."
fmf/uni/semrl,1,"Hja, če si dober študent in živiš za matematiko ... Drugače pa ne razume, da bi radi tudi ostali med predavanji kaj razumeli"
fmf/uni/semrl,5,"Bil je eden boljših profesorjev, kar sem jih kdaj imel. Ta človek je znal matematiko razložiti in približati človeku.
Kapo dol!"
fmf/uni/semrl,5,"Izreden profesor, ki je vložil veliko energije v predavanja. Še vedno se ga spomnim, kot enega redkih profesorjev, ki nam je v prvem letniku pred dokazom kakega izreka najprej intuitivno razložil kaj bo naredil in šele nato formalno dokazal; na koncu pa priznal, da nas je ""peljal žejne čez vodo"", torej je kaj zanalašč spustil ali narobe naredil in smo ugibali kaj. S tem smo vsaj kaj odnesli, ker kot bruci še nismo bili navajeni na formalizacije in dokaze drugih profesorjev."
fmf/uni/semrl,5,"Je že kar nekaj časa od kar sem študiral strojništvo in poslušal predmet Matematika II pri prof.dr.Petru Šemrl. Bil je najboljši profesor z ogromno znanja, ki ga je znal predstaviti študentom. Vsaka mu čast, kapo dolj ni kaj"
fmf/uni/semrl,5,"Defenitivo najboljši profesor, kar sem jih kdaj imel."
fmf/uni/simon-sirca,5,"Pri Moderni fiziki za 2. letnike je suuuuper. Dobro razlaga, nas motivira, snov zna približati, dober odnos do študentov. Odličen pedagog, ki postreže še z zanimivimi anekdotami."
fmf/uni/simon-sirca,5,"Vaje pri mafijskem praktikumu so super. Dobre so razlage, zakaj je nekaj koristno, kako se uporablja v praksi - s tem dodatno motivira študente, da se potrudijo in snov (programiranje) poskusijo razumeti."
fmf/uni/simon-sirca,5,"Torej, glede ekonomije in vodenja ene skupine
namesto dveh moram kljub smileyju na koncu 
prejsnjega komentarja razcistiti zadevo: kadar
se je zgodilo, da je asistent A prevzel se skupino
od asistenta B, je bilo to zato, ker je bil B bolan
ali na sluzbeni poti.  Sicer se nikoli ne gremo
nikakrsne ""ekonomije"".  LpSS"
fmf/uni/simon-sirca,5,"mafijski prak. : 5
moderna vaje : 5
težavnost kolokvijev : 5

povprečna ocena (5+5+5)/3=5"
fmf/uni/simon-sirca,5,"Stajliš, car, pedagog. V"
fmf/uni/simon-sirca,5,"Pri moderni fiziki odličen asistent, zelo sproščeno vzdušje, ne lovi vsake minute in z veseljem pove še kaj v širšem okviru. Dokaj počasen ritem vaj, mogoče bi se dalo na momente celo malo pohitet,ampak smo vsaj vsi razumeli. Očitno ima tudi dober smisel za ekonomijo; sta z Zupanom enkrat cel semester vlekla 2 plači na račun enega dela (bi morali met 2 skupini vaj, pa je večinoma prihajal samo eden in imel vse študente) :)"
fmf/uni/simon-sirca,5,"Rojen pedagog. Se kar pomiriš pred vajami moderne fizike ker veš da boš od dneva vsaj nekaj odnesel če že kje drugje nisi. Ne vem kako mu uspe ampak vse kar pove se zdi enostavno in obvladljivo. Tudi vzdušje v predavalnici je vedno super, sproščeno in produktivno."
fmf/uni/riste-skrekovski,5,"Eden najbolj flegma profesorjev, kar smo jih imeli privilegij poslušati. Na ustnega sploh ne pomislite da bi šli, če želite narediti letnik, sicer pa vredu, zanimivo ga je poslušati."
fmf/uni/riste-skrekovski,1,"Lenuh, da mi nu para!"
fmf/uni/riste-skrekovski,2,Len(uh). Všeč pa so mi njegove bosopete seanse.
fmf/uni/riste-skrekovski,5,Boljši kot zgleda
fmf/uni/ziga-smit,5,"Odličen predavatelj. Izredno korekten. Pride ob uri in konča ob uri. Če ima kaj več za povedat, si ""drzne"" vzet minuto več, samo zato, da se snov bolje razume, pri tem pa se še opraviči za podaljšek...
Kaj čem rečt druzga, kot to da je človek, ki tako zavzeto predava 4 slušateljem kot marsikdo ne stotim!
Na seminarje je prinesel razne pripomočke, kazal filme in delal eksperimente ko nas je bilo peščica, ki smo ga poslušali.
Usni izpit moraš znat pa pika... sicer pa ocenjuje zelo pošteno!"
fmf/uni/ziga-smit,5,Njegova predavanja so razumljiva. Profesor se ful potrudi. Je res med najboljšimi na Fiziki.
fmf/uni/rahela-zabkar,4,"V razredu deluje bolj ""švoh"" pojava, dobiš občutek da bi jo lahko študentje komot nadvladali. S stališča razlage pa čisto v redu asistentka, vendar glede na to da je pri meteorologiji polovica nalog na nivoju srednje šole(ok, z dodatkom integriranja), to naj ne bi bilo tako težko. Kolokviji so primerni glede na vaje (ampak bogpomagaj ko se vmeša Nedjeljka...)"
fmf/uni/nedjeljka-zagar,2,"prvo leto, ko je imela meteorologijo, je bla bolj ko ne žalost. Cele ure je samo prepisovala z lista na tablo, če je imela kaj za povedat je med govorjenjem vztrajno strmela v strop ali zaprla oči, bognedaj pogledat študente. Predavanja tudi niso bila najbolj koherentna in včasih je kar predpostavljala da obvladamo določene zadeve, kot npr računanje z nablo, ko za gradient in divergenco še slišali nismo. Ampak menda je letos rekla da je videla kako slabo je bila lani ocenjena, in da se bo potrudila poboljšat in naredit predavanja bolj zanimiva. V tem primeru pa svaka čast, bi jo blo treba dat za zgled tistim profesorjem ki jih vsi kritizirajo že leta, pa niti ne mignejo da bi kaj spremenili"
fmf/uni/nedjeljka-zagar,5,Super!
fmf/uni/nedjeljka-zagar,5,"Predavanja znajo bit res mal dolgočasna (če si tip niti ne), še posebi zato, ker so na urniku 3 ure skupaj. Mal te zbudi, ko veter ""...zakreče..."" včasih v levo včasih v desno."
