pef/uni/ana-gostincar-blagotinsek,1,"odlična mogoče za razredni pouk in predšolsko vzgojo,vsekakor pa ne za fizike. Od njenega otročjega načina dela nisem odnesel ničesar. Da ne govorim o blesavih plakatih ki niso nikol dovolj dobri,....."
pef/uni/ana-gostincar-blagotinsek,1,"profesor didaktike bi moral uporabljati moderne pristope, biti odprt, prijazen in objektiven v vseh pogledih. Biti bi moral odprt za drugačne poglede na snov, sprejemanje drugih idej in različnih osebnosti ter biti sposoben sprejemati odgovornost in kritiko. No, to ona definitivno ni. Sramota da dela na pedagoški fakulteti, primerna je kvečjemu za kakšno vaško šolo. Pa še ta bi bila nekoliko predobra."
pef/uni/ana-gostincar-blagotinsek,1,"osebno mi kot profesorica na faksu nikakor ne odgovarja. Res pa je, da si jo ne morem predstavljati niti v osnovni ali srednji šoli kot učiteljico, saj uporablja zastarele metode poučevanja ki jih obravnava kot nekaj popolnoma novega. Tudi njen način razmišljanja je nekoliko zadaj, da ne govorim o ocenjevanju ali pa komentiranju nastopov. Ženska te ocenjuje v odvisnosti od tega če si ji prijeten ali ne. Učiteljica ki poučuje didaktiko pa taka. Kako je ona dobila tukaj službo bi bila lahko kar dolga debata."
pef/uni/ana-gostincar-blagotinsek,1,Za didaktiko fizike katastrofa. Prosim dojemite da se v 8. in 9. razredu OŠ učencev ne uči razvrščat in urejat. Iz katerega planeta pa ste?! Mislim smer fizike je kar se tiče didaktike obupna.
pef/uni/ana-gostincar-blagotinsek,1,"Ženska je morala imeti težko otroštvo, da se tako znaša nad študenti pedagoške fakultete in s tem dokazuje avtoriteto. Super zgled za bodoče profesorje..."
pef/uni/ana-gostincar-blagotinsek,1,"Zaradi nje se mi je ideja da bi bil učitelj fizike preprosto uprla. Ne ker je veliko dela ali karkoli, vendar njen odnos in nekonstruktivna kritika preprosto nista za zdržati. Ženska deluje zelo nizko inteligenčna, brez lastnega razmišljanja in kot sem že tukaj prebral, s težkim otroštvom.
Skratka, mogoče jo vidim bolj v kakšnem drugem poklicu, vendar daleč, daleč stran od ljudi."
pef/uni/ana-gostincar-blagotinsek,5,"Meni se zdi super profesorica. Iz vaših (razen prvega) negativnih komentarjev pa je moč razbrati nerazumevanje njene filozofije učenja fizike - in če je do sedaj niste razumeli (in se z njo strinjali), je tudi nikoli ne boste. Medtem pa se bodo ona in isto misleči trudili izkoreniniti neučinkovito poučevanje fizike, ki le-to priskuti marsikateremu osnovnošolcu. Glede ""zastarelih metod poučevanja"" - fiziko se najboljše naučimo po ""primitivni"" poti - še posebej snovi v OŠ in prej - z opazovanjem, tipanjem, poskusi - in to ni zastarelo ampak edino pravo. Glede tega da naj bi bil njen ""način razmišljanja nekoliko zadaj"" in ""Ženska deluje zelo nizko inteligenčna, brez lastnega razmišljanja"" pa lahko samo rečem, kot si rečem tudi neštetokrat med predavanji, ko poslušam vaša neumna vprašanja in med odmori, ko slišim razne diskusije - še slabše kot ne vedeti je misliti, da veš. Če je s svojimi plakati, ki so nenazorni in slabo narejeni, ne prepričate, to še ne pomeni, da je imela težko otroštvo."
pef/uni/ana-gostincar-blagotinsek,5,Čudovita profesorica
pef/uni/veselko-gustin-2,5,"še dobro, da je ta profesor odšel v penzijo. imel je zaničevalen odnos do nas študentov na pef-u. meni osebno ni važno, kam nekdo hodi (na katero fakulteto), tako da je primerjave med pef in fri delat nesmiselno, on pa ti je dal kljub znanju nižjo oceno samo zato, ker hodiš na pef."
pef/uni/tatjana-hodnik-cadez,1,...not good!!
pef/uni/aleksandra-hribar-kosir,1,"zamuja na predavanja in vaje, 
odsotna od predavanj in vaj, brez da bi o tem obvestila študente
ne zna vzpostaviti reda
ni dosledna pri pregledovanju rešitev,
mrmra pred sebe, tako da v polni predavalnici nič ne razumeš
subjektivno ocenjevanje izpitov in seminarskih nalog"
pef/uni/aleksandra-hribar-kosir,3,"Predavanja so nevejetno dolgočasna. Zapravljanje časa res. Izpitov sploh ne pregleduje, temveč ti da oceno kakršno dobiš na seminarski predstavitvi. Le redko se zgodi, da kdo dobi oceno, ki bi bila drugačna!"
pef/uni/miha-koren-je-peder,5,aaa ker pedr
pef/uni/janez-jerman,2,"Dober strokovnjak, toda izjemno slab pedagog, ki ne vidi študentov v predavalnici. Preveč govori, tudi stvari, ki niso ne strokovne, ne primerne, ne dostojne nivoja profesorja."
pef/uni/janez-jerman,1,"študentki na izpitu pokazal ""fuck you"", ko je zastavila vprašanje za boljše razumevanje navodil"
pef/uni/mojca-jurisevic,2,"Zmedena, preveč pozornosti posveča vsem ""motečim dejavnikom"" (študenti ne smejo piti med njenimi predavanji itd.)"
pef/uni/mojca-jurisevic,2,"Med seminarji, ki jih moramo pripravit študentje ona spi. ;)"
pef/uni/mojca-jurisevic,5,"Menim, da je profesorica pri ocenjevanju poštena."
pef/uni/mojca-jurisevic,4,"Res je, da meni, da ni vljudno, da pijemo vodo ali celo jemo ... ampak na zvonenje telefona med predavanjem pa ne reagira tako drastično, kot zna kakšen drug profesor. ;) 
Mimogrede, ima zelo zabavne primere med predavanji."
pef/uni/mojca-jurisevic,5,"Lansko študijsko leto smo jo imeli računalničarji za vaje iz Psihologije za učitelje. Meni osebno ni naredila ničesar, tako da imam z njo pozitivno izkušnjo. Tudi na vajah se je do mene obnašala korektno, na njene seminarje pa tudi nimam pripomb, saj so potekali z njene strani solidno."
pef/uni/branko-kaucic,5,"Profesor Kaučič je vsako leto boljši profesor za programiranje. Vidi se, da stvar zares obvlada in jo tudi nam študentom zelo dobro razloži. Z njim se da vse zmenit in je po mojem mnenju najboljši profesor na računalniški katedri."
pef/uni/branko-kaucic,5,Zelo dober profesor.e
pef/uni/marija-kavkler,4,Dobra in poštena profesorica
pef/uni/urban-kordes,5,"Svežina nadobudnega duha, razgibanost bistrega uma, enkraten slog predavanja."
pef/uni/urban-kordes,5,"Kordeša, slišiš, vidiš in si zapomniš!:)"
pef/uni/urban-kordes,5,Zanimiva predavanja pa še zabavna povrh
pef/uni/tomaz-kranjc,1,"Precej provokativna predavanja. Med predavanji dobiš občutek,da nimaš nikoli nič prav in da nič neveš o ničemer."
pef/uni/tomaz-kranjc,1,Ocenjevanje ustnega dela izpita je z njegove strani skrajno nestrokovno. Pogosto žaljivo do študentov. Za pedagoško fakulteto je tak profesor po mojem mnenju neprimeren.
pef/uni/tomaz-kranjc,1,"Imel sem iste težave. Na ustnem izpitu me je spraševal, ko sva bila sama v razredu: 
kje živim, kje živijo moji starši, kje so zaposleni starši, ali imamo doma kmetijo....Iz odgovorov je sestavil negartivno oceno. Pazite se provokativnih vprašanj...Srečno !"
pef/uni/tomaz-kranjc,5,se strinjam
pef/uni/tomaz-kranjc,5,"Zelo razgledan človek, z ogromno znanja."
pef/uni/janez-krek,5,Vsaka čast profesorju. Prostovoljno mi je veliko pomagal pri statistiki. Hvala!
pef/uni/bostjan-kuzman,5,"Odličen! Pomaga ti pri razumevanju snovi, pripravi ogromno dodatnih nalog, natančen, ... Vsako leto boljši!"
pef/uni/bostjan-kuzman,5,"Tudi js se čudim slabi oceni. Človeški, fajn razlaga, nikol ne da v kolokvij nekaj kar še nikol ne bi vidu.. Kolokvije popravi zelo hitro (tudi v enem dnevu je že blo)."
pef/uni/bostjan-kuzman,4,"Kuzman je super asistent. Slaba ocena pa zato, ker se kdaj vpiči v posameznike in jih včasih prav za res zaničuje."
pef/uni/bostjan-kuzman,5,"Se strinjam z vsemi pozitivnimi komentarji. Vsi predmeti, ki jih ima so res obsežni in je treba res sprot delat....Govorim iz lastnih izkušenj. Pač na začetku se mi je zdel use uizi, po pa najprej zafušam kolokvije. Po pa par dni pred izpitom hard učenje, psiha nardi še svoje in sm valda pogrnla...Najlažji je krivit druge za našo lenobo. Če delaš 100% nardiš, pa tut on z veseljem pomaga,sam morš met fer odnos. Če pa lenarš + neki pametuješ, te bo pa postavu na realna tla, tko da ti bo sam bad."
pef/uni/bostjan-kuzman,5,"snov za algebro 1 je precej dobro razložil, videlo se je, da je v tem predmetu domač. vendar smo ga potem imeli tudi za algebro 2, kjer pa se mi ni zdel tako suveren kot pri enki. pravzaprav je vse kopiral od šparla, ki je bil predtem asistent za algebro 2."
pef/uni/bostjan-kuzman,3,"osebno mi je bila algebra 2 precej lažji izpit kot algebra 1 ... za algebro 2 me ni ravno prepričal, mislim, da ni bil toliko siguren vase kot pri alg 1 ... pravzaprav je pri algebri 2 vse kopiral od šparla, ki je bil pred njim asistent za algebro 2"
pef/uni/bostjan-kuzman,5,"Ne vem zakaj taka slaba ocena. Meni je bil vedno zelo uredu, super razlaga, hitro popravi kolokvije, fer ocenjuje. če prideš k njemu z vprašanjem se vedno potrudi in ti razloži. Je pa res, da sta  bila algebra 1 in 2 najtežja predmeta naPef."
pef/uni/bostjan-kuzman,2,Zelo zaničevalen odnos do študentov. Samo on pa nihče drug
pef/uni/bostjan-kuzman,4,"Zelo dober asistent z zelo dobro razlago, edina pomanjkljivost pri njem je odnos do študentov. Je pa res, da pri njemu moraš stvari razumet in se ne ""napiflat""."
pef/uni/bojan-kverh,5,"Kverh ni bil slab človek in niti slab asistent, edino njegov odnos do študentov ni bil na visokem nivoju. Če si ga karkoli vprašal, te je nadrl in rekel, zakaj sploh sprašuješ."
pef/uni/bojan-kverh,5,bil mi je zelo všeč kot asistent za APS in tudi kot predavatelj za UVR. rad sem hodil na njegove vaje.
pef/uni/ales-leonardis-2,2,"sicer so njegova predavanja še kar v redu, ampak na ustnih izpitih je pa čista loterija. če npr. ne znaš prvega vprašanja, si že padel na izpitu, ne glede na višino pisnega izpita."
pef/uni/irena-lesar,2,"Ojoj. Ženska nima pojma. Predava teorijo, ki je nikoli ni poskusila v praksi. Včasih se pojavijo nedoslednosti med tem kar predava (teorija) in tem kar potem pove, kar ona misli. Je pa zelo korektna in kar reče tudi naredi. Ni prijetna, vzbuja strah."
pef/uni/primoz-luksic,2,"še dobro, da ne uči več ... on je dvakrat kar jedel zajtrk med vajami ... pa tudi kar se tiče razlage, je skoraj tako, kot da je ni ..."
pef/uni/primoz-luksic,1,Katastrofa! Popolnoma izgubljen tip...
pef/uni/zlatan-magajna,5,"zelo v redu profesor, bil mi je eden najljubših profesorjev ... sicer je pri njemu tako, da celo leto delaš skoraj samo njegov predmet, ker imaš toliko za naredit, pa vendar te tudi na koncu nagradi z dobro oceno ..."
pef/uni/malnic,5,"nikoli zares nisem razumel študentov, ki hodijo na izpite kar tako oz. nepripravljeni. če nič ne znaš odgovorit na vprašanja, je logično, da boš: ne samo padel, ampak kar letel na izpitu. logično, da te bo vrgel. če se boš dobro pripravil za naslednjič, ampak to pomeni dobro naštudirati snov pri predmetu, te ne bo mogel kar tako vržt. malnič te vpraša zgolj osnovna vprašanja, osnovne defincije, in hoče razumeti tudi na primerih. je pa res, da te veliko časa sprašuje in obširno."
pef/uni/malnic,5,"Njegova predavanja so zanimiva, in se s spontanimi pripomočki potrudi obrazložiti snov, da bi jo študenti razumeli. Edino kar bi lahko kot negativno rekla je, da je predava bolj tiho, še posebej če so študentje glasni, ampak še tista peščica, ki jih to zanima, da bi snov slišali v celoti morajo sedeti v prvi vrsti in napeto poslušati. Navdušil me je, saj so celotne razlage lahkotne in občutek imaš, da algebra, ki jo predava res ni težka. :)"
pef/uni/malnic,2,Če padeš prvi izpitni rok pri njemu ga ni dnarja da nardiš ta izpit...res škoda da tok dobrmu profesorju take stvari zbijajo oceno.
pef/uni/nancovska-serbec,5,Odlična asistentka. Profesorica z neizmernim človeškim čutom in z odličnim strokovnim znanjem. Takšnih profesorjev manjka.
pef/uni/nancovska-serbec,5,"Če nimaš predznanja je mogoče res malo težji razumet predavanja...ampak če ji poveš česa ne razumeš se res potrudi,da ti na najbol preprost način razloži...Drugače se ji pa itak že na kilometr vid,da želi,da nas čimblj nauči,ampak včasih je teško začetniku razložit obsežno snov,če nima predznanja,zato pa moramo toliko bolj gart na začetku,ampak se res splača,ker so njene ure pol res zakon!"
pef/uni/nancovska-serbec,4,"Res pravijo, da je do vseh čisto materinska, na žalost pa so njena predavanja precej dolgočasna, ker samo bere iz prosojnic..."
pef/uni/jerneja-pavlin,5,"Dobra pedagoginja, z občutkom za snov in študenta. Vaje pri njej so bile vedno zanimive!"
pef/uni/jerneja-pavlin,5,deluje mi zelo materinska in zelo prijazna
pef/uni/mojca-pecek-cuk,1,"Mojca celotna predavanja prebere (pove) iz svoje knjige Moč vzgoje, tudi primeri so na predavanjih zgolj tisti, ki jih ima navedene v knjigi. Pri izpitih je prav tako pomembna zgolj njena knjiga Moč vzgoje, ki se jo je treba skoraj na pamet naučiti."
pef/uni/alenka-polak,5,"Vedno nasmejana in navdušena, super profesorca."
pef/uni/alenka-polak,1,"Pazite se te ženske. Če vas ne bo sprejela ali vas ne bo imela rada iz kakršnega koli razloga, ste spasili. NORA JE! IN pripravljena iti do konca in še dlje, samo da dokaže, da ima ona več moči kot ti!"
pef/uni/branka-potocnik-krajnik,1,"Komentar ne bo žaljiv. 
Žaljiva, nesramna, vzvišena, diskrimainatorna, osorna, verbalno nasilna, ki izvaja psihično nasilje nad študentkami.Izbere si svoje študentke, ki jih ""ima rada"", potem pa še tiste, ki jih ne mara. Do njih se obnaša, kot že omenjeno. Ko sem bila pri njej na izpitu v kabinetu, me je gledala v oči in vame vpila ""grda ste, grda ste"". Zelo sem se je bala, ker je bila zahrbtna.Ne zasluži si imena  pedagoška delavka."
pef/uni/rok-pozar,5,Rok <3
pef/uni/rok-pozar,5,Vatreni<3
pef/uni/dusan-repovs-2,1,"Možakar je čuden, njegova predavanja so sicer dokaj v redu, vendar je odnos do študentov precej zgrešen."
pef/uni/david-rihtarsic,5,"Vedno dobre volje,vedno nasmeje...uglavnem super je! :)"
pef/uni/david-rihtarsic,5,se mi zdi da je celotni tehnični oddelek precej v tem stilu razen JJ :)
pef/uni/rovsek,3,"Ženska s fiziko živi in jo obvlada. Vendar za moje pojme ni primerna za poučevanje fizike oz. voditi vaje, ker se težko spusti na nižjo raven razumevanja in stvari po domače razloži. Je super, vendar bolje za na Štefanov inštitut in raziskovanje."
pef/uni/rovsek,5,"Se strinjam s prejšnjim komentarjem.
Fiziki, ki obvladajo pedagoške veščine so redki. Ona ni ena izmed njih."
pef/uni/rovsek,2,Over-rated :)
pef/uni/joze-rugelj,5,"on je načeloma zelo v redu in se z njim da vse zmenit, edina pomanjkljivost pri njegovih ustnih izpitih je ta, da se včasih preveč zapiči v eno besedo, ki jo želi na vsak način slišat."
pef/uni/joze-rugelj,5,"jaz z njim nisem imel slabe izkušnje, tako da ga ocenjujem kot zelo dobrega profesorja. :)"
pef/uni/joze-rugelj,1,"Jaz imam totalno nasprotno izkušnjo. Ko je potrebno razreševati probleme se njim ne da nič zmeniti, izjemno trmast, zagledan vase povrh pa še aroganten. Na predavanjih sicer deluje miroljuben, študentje pa s tem nimajo težav, saj lahko počnejo druge reči."
pef/uni/joze-rugelj,1,"Nespoštljiv, dolgočasen, aroganten in pristranski so argumenti že sami po sebi!"
pef/uni/igor-saksida,5,"Ta profesor je največja legenda kaj jih je! To je vse kaj mam za povedat :)) Dal bi oceno 10, pa ne morem :/ Res, zakon je :D"
pef/uni/barbara-sicherl-kafol,1,"Profesorica občasno pozabi na GU, včasih pa jo čakaš po več ur, čeprav si dogovorjen za točno določeno uro. Od predavanj ne odneseš veliko, ko pa prideš do prakse in nastopov si prepuščen sam sebi."
pef/uni/darja-skribe-dimec,5,"Profesorica, ki si želi, da se ves svet zaveda živega sveta okoli sebe in ji ni vseeno, kakšni študentje gremo pred otroke. Nekako imam občutek, da ne trpi nevednosti, zato nas ves čas preverja, ali svet razumemo ""prav"", ves čas preverja znanje in razumevanje. 

Sicer pa zelo naivna, se mi zdi, do tega, da bomo počeli vse tako ambiciozno kot to počne sama. Nekako je balzam med naravoslovnimi profesorji in ena tistih, ki se predaja za ceno študentovega znanja. Ogromno citira, za kar ji dajam 10ko! 

In tudi za izvirne učne ure z ogroooooomno didaktičnega materiala. Res živi to, kar govori."
pef/uni/marko-slapar,5,"Zame verjetno najboljši profesor na Pedagoški fakulteti, tako z vidika odnosa do študentov kot tudi strokovnega znanja in podajanja le-tega."
pef/uni/dejan-sraka,5,"Super profesor! Vaje so zlo obsežne,treba je sam sprot delat!"
pef/uni/dejan-sraka,5,"Eden od redkih asistentov, ki jim uspe držati odličen kompromis med profesionalnostjo in človeškostjo. 
A1!"
pef/uni/dejan-sraka,5,"Z njim kot asistentom nisem imel slabe izkušnje, tako da se mi zdi zelo v redu asistent iz računalniške katedre."
pef/uni/dejan-sraka,5,"imel sem ga samo za predmet programiranje. bil mi je relativno kar všeč, dobro je znal razložiti, vedno je bil tudi dosegljiv na mailu ali za pomoč pri domači / seminarski nalogi ... 
za uvod v računalništvo ga pa ne morem ocenit, ker sem imel še kverha."
pef/uni/tadej-starcic,5,"Men zmaga z izjavo: Pa sj to ni tok teško,sam mal čudno je! :)"
pef/uni/tadej-starcic,5,"Odličen asistent s čutom za razlago.
Njegove primere:""Graf tega odvoda je kot sedlo, se pravi, kot če prerežemo konja na pol in vzamemo potem zgornji del...."" pa so odlična popestritev ure :D"
pef/uni/tadej-starcic,1,"starčič nima pojma od matematke! jst sm velik bolš!

pa če ta človk kdaj ne bo zamudu na izpit al pa kolokvij bo tud čudež!

lahko gre kr po izpisnico! XD"
pef/uni/tadej-starcic,2,"nekako se mi dozdeva, da se še uči, kako biti asistent na faksu ... to se mi zdi tudi za izpit ... 
zdi se mi, da tudi še tipov nalog za izpit ni ustrezno sestavil, saj je bil 1. rok pri EM precej lažji kot naslednji ..."
pef/uni/veronika-tasner,3,"Daje premalo navodil. Če so so nejasna. 
Izjemno razgledana, pametna. Kot profesorici ji manjka toplina."
pef/uni/veronika-tasner,1,"Nečloveška, čeprav razgledana. Obravnava težkih in nepomembnih besedil, ki v praksi nikakor ne koristijo.predava preveč strokovno, neosebna komunikacija in napeto ozračje"
pef/uni/veronika-tasner,5,Resna in temeljita
pef/uni/beatriz-gabriela-tomsic-cerkez,5,Izjemno prijazna gospa s katero se vedno najde tema za pogovor. Njene ure na filozofski fakulteti so za mene osebno najboljše.
pef/uni/maja-umek,1,"Spoštovana !
Živimo v malem mestu, ki nima ""lokalca"" in ne železnice. Smo pa namenoma naredili izlet v Ljubljano.
V vašem učbeniku Družba in jaz 2 pa prosim rešite nalogi 1 in 2 na strani 34,35 z obzorjem znanja 10 letnega otroka.
Zdaj razumem zakaj naj komentarji ne vsebujejo žaljivk.
Pa brez zamere, ker me skrbi kaj bo z znanjem mojih otrok v prihodnosti predvsem zaradi zelo malega števila učbenikov, ki otroka pritegnejo k učenju in ne odvračajo.

Lp Karin"
pef/uni/matej-urbancic,5,"Najboljši asistent na svetu!
Vaje pri njemu so izredno dinamične, zanimive in občasno tudi zabavne. 
Prof. Urbančič je prava osvežitev v drugače zateženih kemijskih prostorih, njegove sposobnosti razlaganja se da opisati samo v presežnikih, vse svoje stike gradi na pozitivnih odnosih, je izredno pameten in izobražen, predmet zna približati prav vsakemu študentu, IQ pa ima najbrž v štirimestni obliki. Presneto, včasih se mi zazdi, da najbrž tudi njegovi pr*ci dišijo po rožicah..."
pef/uni/janez-vogrinc,5,"Želim si, da bi vsi profesorji razlagali tako sistematično, jasno in jedrnato kot profesor Vogrinc. Od dveh ur njegovih predavanj odnese študent več kot od petih pri nekaterih drugih predmetih."
pef/uni/janez-vogrinc,5,Zelo razumljivo in sistematično predava.
pef/uni/janez-vogrinc,5,"Super profesor, jasen, razumljiv, enostavno in strokovno razloži, tudi zabaven na predavanjih, le preveč svojega časa preživi na fakulteti - živi za fax :)"
pef/uni/janez-vogrinc,5,"Odličen predavatelj z včasih sarkastičnim humorjem, a ni žaljiv. Zna poslušat do konca, razume, kaj govoriš, in zna odgovorit v formatu, da ga razumeš tudi ti. Hiter kot strela. Prijetna osvežitev."
pef/uni/janez-vogrinc,5,"g. Vogrinc predava super; razumljivo, le včasih malo prehitro. Med predavanji se kdaj tudi pošali, je pa prav poseben s svojo pojavo in urejenostjo :)"
pef/uni/janez-vogrinc,5,Vedno se zavzame za študente. Tip na mestu!
pef/uni/janez-vogrinc,5,"Najboljsi predavatelj, res je top of the top."
pef/uni/katarina-senta-wissiak-grm,1,"Ona in njej podobni pedagogi ne bi smeli učiti. Sitnoba in zabitost sta njeni edini ""kakovosti""."
pef/uni/darij-zadnikar,5,Dr. Zadnikar je redek primer ustrezne razgledanosti in inteligentnosti med profesorji na PeF-u.
pef/uni/darij-zadnikar,2,na njegovem predavanju iz filozofije sem bil samo enkrat - na uvodnem predavanju. najbolj nepotreben predmet na tem faksu ... prispodobe z dvoživkami za študente?
pef/uni/konstanca-zalar,5,"Prinaša nove, dobre ideje, 
ni pikolovska, do olikanih  štidentov izredno korektna
ne komplicira, svetuje
Imam zelo dobre izkušnje in več novih idej, škoda, da je vajam namenjenega premalo časa."
pef/uni/matej-zapusek,5,"THE BEST je! :). Tut če nimaš predznanja ti postane programiranje number 1 predmet,ker je res the best profesor!"
pef/uni/matej-zapusek,5,Ni boljšega asistenta. S svojim načinom učenja bi še  ekonomiste naučil programiranja....
pef/uni/matej-zapusek,5,"On je super. Uči predmet, ki ga je težko razložit, pa mu vseeno uspeva. Odlična razlaga (tudi če nimaš predznanja, kr js ga nisem imela), prijazen, res mu velik pomeni, da ga mi razumemo. O da bi bli sami taki.. :)"
pef/uni/matej-zapusek,4,"meni pa ravno on ni najboljši asistent, saj se pri dveh predmetih (OARS in RK) ni držal obljub, ki jih je dal na vajah za kolokvij ali pa izpit ... na koncu je to čisto drugače zgledalo kot je sam rekel, da bo ... s tem se mi je zameril"
pef/uni/tomaz-zwitter-2,5,"Njegova predavanja so odlična, prav tako tudi odnos do študentov."
pef/uni/cepic,5,"Dr. Mojca Čepič je po mojem mnenju daleč najboljša predavateljic FIZIKE na ljubljanski pedagoški fakulteti.

Njena predavanja so zanimiva in odneseš lahko veliko.
Zaradi njenih predavanj se je v času študija bilo vredno vstajati za k predavanjem ob 8.00.

David"
pef/uni/cepic,1,"Zelo subjektivna pri ocenjevanju (toliko o znanju iz didaktike fizike). Takoj si najde par ""ljubljenčkov"" v razredu in tisti bodo oh in sploh ostali pa gnoj. Vsiljuje svoj prav ne glede na to kaj trdijo vsi ostali fiziki na planetu. Tečna in zamerljiva. Le predavanja so kolikor toliko za poslušat."
pef/uni/cepic,3,"Kar se tiče predavanj iz fizike je odlična profesorica. Tudi predavanja iz didf1 so v redu, le njen odnos do študentov se je temeljito spremenil. Iz dobrohotne osebe je posala trmast, neposlušen človek, ki je (po njenem) precej več vreden kot študentje.
Davidov sošolec v 1.letniku PeF, a še vedno prijatelj:)"
pef/uni/cepic,1,Zelo ozkogleda profesorica.
pef/uni/cepic,1,"Stalno pravi, da je le teoretik. Kako lahko teoretik poučuje didaktiko? 
Gospodična nima pojma o realnih razmerah v učilnici, temu primerno se nad njo zgražajo osnovnošolski učitelji."
pef/uni/marijan-simenc,5,"ni mi všeč njegov odnos do študentov, ki gredo na pisni izpit iz sociologije ... imam občutek, da sploh ne prebere tvojih odgovorov na izpitu, in da ocenjujejo kar na slepo (npr.  nekdo bo naredil, nekdo pa ne) ... 
tako da se ne čudim, da se obrazi na izpitu kar ponavljajo ..."
pef/uni/marijan-simenc,1,"vedno daje ista vprašanja pri izpitih, tako da vedno točno veš, kakšna bodo vprašanja v izpitu, ampak problem pri njem je, da ne ocenjuje znanja, ampak kar malo po svoje ... zelo neumno pa se mi zdi, da pri izpitih omejuje število stavkov, v katerih mora biti podan odgovor. ti ne moreš neke sociološke teorije podat v dveh stavkih!!!"
pef/uni/primoz-sparl,5,"Odlično predava (uporablja veliko primerov pri razlagi), zelo velik poudarek daje na razumevanju snovi, kar se mi zdi the best :)..."
pef/uni/primoz-sparl,5,"Super predava, je urejen, pri ustnih izpitih zelo prijazen in fajn ocenjuje."
pef/uni/primoz-sparl,5,"Profesor Šparla sem imel še v 1. letniku pri Analizi 1 kot asistenta. Že kot asistent mi je bil zelo v redu, vedno je bil prijazen do mene, dobro je razlagal snov pri Analizi 1. Potem sem ga imel kot profesorja za računalniško matematiko in kombinatorično optimizacijo. Kot profesor je zelo v redu, veliko daje primerov, zgledov, dokazov, snov zelo dobro razloži ...."
pef/uni/primoz-sparl,5,"Zelo zahteven, ampak pošten, natančen, dosleden, najbrz najboljsi predavatelj na pedagoški."
pef/uni/primoz-sparl,5,Ta profesor ima najbolj hudo ritko na svetu.
pef/uni/primoz-sparl,5,Ta profesor ima najbolj hudo ritko na svetu.
pef/uni/vesna-stemberger,5,"Vesna je najboljša profesorica, kar jih je svet poznal. Študent pri njej ni le številka in pri vseh študentih, ki jih poučuje, od vsakega ve osebne stvari, katere ostale profesorje sploh ne bi zanimale. Je lep vzor vsem bodočim profesorjem/icam. Zasluži si oceno 5!"
pef/uni/vesna-stemberger,5,"Se strinjam, Vesna je daleč najboljša predavateljica in asistentka.:) Vedno je pripravljena pomagat, daje veliko nasvetov, pove veliko svojih izkušenj.. Posebej pohvalno pa je to, da se res posveti vsakemu študentu, si ga zapomni, že na drugem srečanju ve imena od vseh.:) res si zasluži oceno 5!:)"
pef/uni/vesna-stemberger,5,"Vesna je res, kapo dol, najboljša profesorca kar jih je Pedagoška fakulteta spoznala! 
Vedno pripravljena pomagat, poslušat, si vzet čas ko jo rabiš...na maile tud vedno odgovarja in to zelo lepo in hitro. 
Vedno se da tud pohecat z njo in pač ne vzame tega resno, kot bi to kakšen drug profesor na fakulteti. 
Vaje so vedno zanimive, prav tako predavanja. Predavanja so ena redkih, pri katerih ti je skoraj žal, če se predčasno končajo.
Uglavnem Vesna je top of the top! :)"
pef/uni/alenka-zerovnik,1,Za asistentko samo ena beseda: katastrofa!
