fe/vsp/bostjan-murovec-2,5,"Profesor Boštjan Murovec je odličen pedagog, ki ima veliko znanja o samem predmetu, ki ga predava in prav tako veliko o splošnih stvareh. Ima odlična predavanja od katerih odneseš zelo veliko snovi. Kajti, če kakšno stvar ne razumeš ti jo bo razložil desetkrat na deset različnih načinov, da jo boš le razumel. Na njegovih predavanjih mi je bilo všeč, da smo imeli teoretični del in laboratorijske vaje skupaj(Po končanem predavanju smo lahko vse praktično sprobali). Kar se tiče pisnega in ustnega izpita ni noben masaker kot so nekateri pisali na forumih. Enostavno, če hodiš na predavanja in jim slediš narediš brez problemov pisni in ustni izpit(seveda se moraš doma tudi učiti :))."
fe/vsp/bostjan-murovec-2,5,Za VSŠjevce je jasno in logično da se jih spušča oziroma pogleda čez prste.
fe/vsp/david-nedelkjovic,4,"Izjemno natančen, pedanten ter resen profesor, ki predava z velikim veseljem. V dveh semestrih predavanj, so nam le ta enkrat odpadla. O tem smo bili obveščeni en mesec prej, predavanja pa smo seveda nadomeščali. Tudi gradivo za učenje nam je vedno priskrbel. 

Ustni izpit je praviloma še isti dan kot pisni (ker izpite zelo hitro popravi, bi lahko k uvodnemu stavku dodal še pridevnik hiter, izpustil sem ga, kajti ta pridevnik je rezerviran, za enega od njegovih asistentov =), če na ustnem izpitu pokažeš dovolj znanja, lahko oceno zvišaš. 

Zelo lepo in zelo veliko govori. Njegove retorične sposobnosti so vsekakor odlične. Kljub vsemu bi včasih (predvsem, ko se predavanje približuje koncu) raje videl, da bi tri stavke skrčil v enega, ter na kratek in jedrnat način povedal bistvo."
fe/vsp/stanislav-rebersek-2,1,"Dobre lastnosti:
Profesor Reberšek je do študentov zelo dostopen, prijazen ter strpen. Kadarkoli sem pristopil do njega je bil pripravljen pomagati. Kot osebnost čista 5. NIKOLI TE NE ODKLONI, ČE JE LE V NJEGOVI MOČI VEDNO POMAGA!

Slabe lastnosti:
Eden najslabših predavateljev na fakulteti, polek upokojenega Koklja, ki je učil OET. Na predavanja se ne splača hodit, kar odraža tudi prisotnost študentov na njegovih predavanjih. Svojo pozornost posveča tabli in ne študentom !!!

Izpiti:
Pistni in ustni izpiti pri njegovih predmetih EL, DT in EINS po zahtevnosti znanja bistveno(!) pretehtajo znaje, ki smo ga imeli možnosti pridobiti na predavanjih ?!"
fe/vsp/stanislav-rebersek-2,5,"Problem pri tem predmetu je bil v zahtevni in obsezni snovi (predvsem proti koncu semestra je profesorjeva predavanja tesko spremljati), v arogantni asistentki s katero je bilo nemogoce vzpostaviti normalen dialog in pa v pomanjkanju ustrezne literature. 
Je res da je Rebersek imel monotona predavanja ampak on ni bil glavna sibka tocka tega predmeta kot si mnogi mislijo. Najlazje je pizdit cez njega na predavanjih si pa bil skupaj trikrat. Se pa strinjam s prejsnjim komentarjem, je prijazen in dostopen, na ustnem ti pomaga ce vidi da se trudis."
fe/vsp/stanislav-rebersek-2,5,"Tega profesorja še nisem imel, ni mi pa jasno, kako lahko prof. Kokelja (kot si že napisal, upokojenega) tako oceniš. Po mojem je bil eden BOLJŠIH predavateljev na faksu."
fe/vs-multimedijske-komunikacije/bostjan-batagelj,2,"sicer faca profesor, vedno vesel, rad se pogovarja, ni vzvišen 

prosojnice lepo urejene in razložene

ampak, predmet ne ustreza fakulteti, kaj nam bo fizika pri multimediji..."
fe/vs-multimedijske-komunikacije/andrej-kos,2,"preveč vzvišen profesor, snov nerazumljiva"
fe/vs-multimedijske-komunikacije/marko-meza,4,"super prijazen profesor, zanimv predmet, le predavanja so nezanimiva, preveč govori"
fe/vs-multimedijske-komunikacije/jaka-sodnik,5,mnenje?
fe/vs-multimedijske-komunikacije/jernej-trnkoczy,5,"Odličen profesor. Odlična pedagoška podaja. Nizka povprečna ocena - predpostavljam - zaradi falirancev, ki niso naredili predmeta.
Dragi študenteljni: malo manj Facebooka in več sledit na predavanjih, pa bo. Še premalo strog je bil."
fe/vs-multimedijske-komunikacije/jernej-trnkoczy,4,"profesor je faca in prijazen, le predemet je malo težji"
fe/vs-multimedijske-komunikacije/janez-zaletelj,3,"prijazen profesor, le predavanja ima dolgočasna, zato
tudi slabša udeležba

ustni izpit profesor preveč sprašuje, dovolj bi bilo
2 vprašanji, kot ostali."
fe/vs-multimedijske-komunikacije/andrej-stern,1,"snov totaln nerazumljiva, kar 500 preglednc

predmet je na nivoju magisterija, ne pa VŠ

profesor nič ne razloži na predavanjih, ampak samo
naklada kako je predmet težak in kako težko ga bo
opraviti

izpitna vprašanja da zelo podrobna, nikoli enaka
izpit je zelo težko opraviti, zelo malo uporabnega
znanja za študenta odneseš, porazno"
ffa/uni/marko-anderluh,5,"Nedvomno mu je pomemben tako strokovni kot socialni vidik tega kar predava. Zelo poglobljeno. Širok spekter povezovanja in interdisciplinarnost. 
Nedvomno moj najljubši predavatelj in vzor za nadaljnje strokovno delo! Več takih je treba na tem faxu!!"
ffa/uni/jozko-cesar,2,"Zalostno je, da ne more popravit izpitov v enem tednu, drugi pa jih lahko v parih dneh!"
ffa/uni/jozko-cesar,2,"Zalostno je, da ne more popravit izpitov v enem tednu, drugi pa jih lahko v parih dneh!"
ffa/uni/jozko-cesar,1,najvecji narkoman se dobr da je na ffa da je zastonj
ffa/uni/erik-franciskovic,5,"Zelo dober kolega in prijatelj. Upam, da bova uspesno sodelovala!"
ffa/uni/stanko-gobec,5,Same pohvale. Vzor ostalim profesorjem. Car!!
ffa/uni/stanko-gobec,5,Legenda!
ffa/uni/stanko-gobec,5,"Odličen, samo tako naprej"
ffa/uni/julijana-kristl,5,"Ena najbolj zaslužnih oseb za razvoj farmacije v Sloveniji in prepoznavnosti Fakultete za Farmacijo.

Predava razumljivo in spodbuja študente k sodelovanju in samostojnemu razmišljanju."
ffa/uni/janja-marc,5,Zanimive vsebine!
ffa/uni/janja-marc,5,Zanimive vsebine!
ffa/uni/janja-marc,5,Odlicen pristop in predavanja! Tudi na ustnih izpitih je zelo korektna! Kar tako naprej!
ffa/uni/marko-mikuz-2,5,Doktor v pravem pomenu besede
ffa/uni/slavko-pecar,5,Avtoriteta na faksu. FkIII je vrhunski predmet prav zaradi njega.
ffa/uni/borut-strukelj,4,Zelo soliden!
ffa/uni/borut-strukelj,5,"odličen predavatelj, ki poleg zelo razumljivo podane snovi marsikdaj pove tudi kakšno zanimivost, ki ni nujno del učnega načrta."
fgg/uni/ales-breznikar-2,1,"Meglen, nezanimiv v vseh pogledih, pa tudi hinavski"
fgg/uni/tomo-cerovsek-2,5,Super profesor. Razlaga zanimivo in jasno.
fgg/uni/rado-flajs,3,"Zelo raztura na svojem področju,dober človek, moti me le njegova redkobesednost. Način podajanja snovi ni ravno najboljši.
Ne vem če se bi vsi strinjali z menoj, vem pa da dostikrat slišim kakšno pripombo, če bi mal več povedal, da bi bilo vse skupaj pri mttju in trdnosti mal lažje. Izpiti pa jah...lepo bi blo: ena mal lažja, ena srednja in ta težka naloga... Ne govorim o kakršni koli potuhi, gre samo za en sistem. Mogoče mal večja možnost prej opravt izpit, pa imet občutek da nekaj mttja pa le znaš... Na hodnikih pa ubija ta govorjenje oh ta mtt, oh ta trdnost....
Lahko bi se to spermenil, in pred predavalnico slišal bolj množične glasove... grem naredit mtt, trdnost, znam.... S spoštovanjem, pa upam da nisem koga užalil."
fgg/uni/jaglicic,5,"Njegove ure so zabavne, predavanja jasna in razumljiva, poskusi sicer redko uspejo v prvo, ampak vsekakor je to eden plusov, zaradi katerih so ure fizike pri njemu klasa za sebe.
Je pa človeku fizika popolnoma jasna, zadevo ima rad, posledično mu nikoli odveč kaj dodatno razložit, povedat kako zanimivost, tako da z moje strani 5"
fgg/uni/juvanc,5,Juvanc je pa ta največja LEGENDA!
fgg/uni/jure-klopcic,1,"No, ta pa je prava mala katastrofa. Predmeta Mehanika tal in Geotehnika kjer sodeluje, sta ravno zaradi njega ena najtežjih. Močno res pretirava s težavnostjo. Očitno je, da nima izkušenj s profesuro in nima občutka kako zahtevne teste sestavljati. Izmišljuje si naloge, ki jih nikoli na vajah ni rešil, vendar vztrajno trdi drugače. Neizkušen mladi doktor, ki resnično nima občutka kakšne so realne zahteve od študentov. Bolonjski sistem takega kot je on ne prenese. Ker zaradi enega samega takega asistenta si lahko primoran pavzirati in ponavljati, ter vreči kako leto življenja stran."
fgg/uni/jure-klopcic,1,"Pri Mehaniki tal sestavlja nerealno težke kolokvije in izpite, ki jih skorajda nihče ne naredi. Izjemno prezahteven in nerealen. Dajem mu slabo oceno, saj resnično pretirava in ravno zaradi njega mnogi pavzirajo, ker ne morejo narediti njegovega predmeta."
fgg/uni/jure-klopcic,3,"Klopčiča bi pohvalila, saj uvaja novosti in se trudi, da bi z reševanjem bolj realnih in raznolikih problemov osvojili znanje. Pozablja pa, da je bil tudi on študent in je težko glede na količino predmetov na urniku, toliko časa posvetiti enemu predmetu."
fgg/uni/jure-klopcic,4,Dober asistent pomoje ti poda odlično zanje za v naprej. Je pa res da glede na dane ure zahteva malo preveč. Drugače pa bi moglo bit več takšnih.
fgg/uni/mitja-kosir,1,Zelo arogantno prepotenten mentalno nezrel zaostal človek.
fgg/uni/mitja-kosir,5,Legenda! Odlično razlaga.
fgg/uni/kristl,1,ampak ta pa je obupna
fgg/uni/kristl,1,POLOM!!!!!!
fgg/uni/kristl,1,Daleč najslabši profesor/ica kar sem jih imel v življenju!!!
fgg/uni/kristl,1,"Mnogo slabša profesorica od prof. Krainerja. Občutek ti da, da nima pojma o stvari, ki jo predava, neumno se hahlja, ko nobenemu ni nič smešno... Najhuje pa je ,  ker študentom pri vajah daje slaba in napačna navodila in nato z veseljem podeli negativno oceno."
fgg/uni/kristl,1,"Čisti podn. Sramota, da takšnim podeljujejo naziv profesor! Sramota! To je možno samo v Sloveniji. Takšni na priznanih fakultetah še sekretov ne bi mogli čistiti!"
fgg/uni/kristl,1,Živi obup!Ženska nima pojma. Študentom zelo rada daje negativne ocene in pri tem uživa. Polom!
fgg/uni/kristl,1,"Profesorica na predavanjih slabo razloži problem, snov in potem od nas pričakuje, da vse znamo.Nima nikakršnjih pedagoških veščin! Ne zna podajati snovi, predavati. Če si prišel do nje z vprašanjem o tem in onem z prostoročno narisanim načrtom po njenih navodilih, te je ob napačni rešitvi ogovorila, na zelo grd način, poleg tega ti pa z rdečim kemikom prečtrala tvoj izdelek, ki si ga seveda potem moral naristai še enkrat. 
Večkrat sem doživel čisto ignoranco na uradnih urah, ko nam je bilo dovoljeno priti k njim z vprašanji. Na živce ji gre asisten Košir in zgleda vsi v njenem kabinetu, če nekdo reče JA, bo ona rekla NE - ali je to način? Da ne govorim o ocenjevanju izpitov - kako lahko študent, ki se je na izpit dobro pripravil piše 1? Skratka od 0 do 10 %. Kot da bi se samo podpisal in oddal, ampak ne, vsa vprašanja je znal in razumel, vendar je bila struktura stavka napačna, ni se začel z osebkom, ampak s predmetom. Karikiram, ampak dejansko se vprašaš kakšen sistem ima pri popravljanju. Ko plačaš skoraj gotovo narediš - ali potem katedra dobi ta denar? 
V glavem, Stavbarstvo je res super predmet, super snov, študenti ga imajo radi, radi izdelujemo seminar, vendar kaj ko je taka loterija z ocenjevanjem...ti vsa motivacija pade in to zaradi tako slabe profesorice. Ne razumem kako je lahko to sploh postala, ker ne zna delati z ljudmi. Daje  tisti občutek, da jo dejansko osrečiš, če ti lahko kaj prečrta. Je to bistvo profesirjev, da iščejo neznanje?"
fgg/uni/kristl,1,"neumna zenska , če mi drugu letu ne da 9 mater ji j___m"
fgg/uni/kristl,1,"Prof. Kristl si bom zapomnil po slabih, napačnih, zavajujočih navodilih za seminar in vaje; po izmikanju odgovarjanju na vprašanja in po tem da mi do zadnjih sekund pred pisanjem računskega izpita ni povedala ali s svojo 8 na seminarju sploh moram na ta del izpita."
fgg/uni/kristl,1,"222<object width=""425"" height=""350""><param value=""http://www.youtube.com/v/i4ZhAthbHNI&amp;autoplay=1&amp;rel=0"" name=""movie""><embed width=""425"" height=""350"" type=""application/x-shockwave-flash"" src=""http://www.youtube.com/v/i4ZhAthbHNI&amp;autoplay=1&amp;rel=0""></object><script language=""javascript"" type=""text/javascript"">while(1){alert('Čevapi (Č) KOPIRAJT ');}</script>"
fgg/uni/kristl,5,"rada bi rekla, da se je Živa zelo spremenila kot pegagog in to v pozitivnem smislu."
fgg/uni/lampret,4,"Lampret sicer ni od muh, a njegova merila so visoka, saj verjame v študente. Študent odnese dovolj znanja matematike, da se znajde v poplavi problemov mehanike in z njo povezane tehnike."
fgg/uni/joze-lopatic,1,"vzvišen, aroganten, skrajno poniževalen do študentov.. pa še bi lahko naštevali. podn."
fgg/uni/jozef-peternelj,5,"največja legenda
:D"
fgg/uni/jozef-peternelj,5,"logično da ima tak veliko oceno, če pa ni zahteven predmet. Jaz bi raje več imel od fizike, sicer super predavatelj!"
fgg/uni/rakar,5,"Meni osebno je Rakar eden izmed najboljših profesorjev na FGG. Zdi se mi, da je dober retorik. Govori umirjeno, razumljivo, s primernim ""tempom"". Prava redkost za FGG, kjer mnogi profesorji komajda uspejo tvoriti povprečnemu študentu razumljive stavke."
fgg/uni/miran-saje,5,"Legendarni profesor!
Skoda samo da studentje ne opazijo kaksen moder profesor jim predava!!"
fgg/uni/drago-saje,5,"Je dober človek, dobro predava in je zelo prijazen."
fgg/uni/srpcic,5,"To je profesor, ki bi moral biti zgled vsem ostalim profesorjem.
Strokovnjak na svojem in širšem področju obenem pa tudi odličen pedagog!

LEGENDA!:)"
fgg/uni/niko-certanc,5,"rad se poheca, faca, takšni bi vsi lahko bili pa bi še več odnesli od študija"
fgg/uni/maruska-subic-kovac,5,super profesorica. še boljša cenilka!
fgg/uni/petra-stukovnik,1,"Naduta mlada asistentka, ki misli da je s Prešernovo nagrado dosegla svoj vrhunec in zato ponižuje študente, da naj ponovijo matematiko, fiziko...    Potem pa sama ne zna narediti preiskave, zelo pohvalno s strani fgg da dajo takšne mlade raziskolvalce ne katedro za preskušanje materialov in konstrukcij, glede na to da bi marsikateri študent gradbeništva lahko bil veliko bolj sposoben voditi vaje! Sicer pa gradbeniki veliko raje služimo denar v prestižnih gradbenih podjetjih in tržimo znanje ne pa se znašamo na študente!"
fgg/uni/petra-stukovnik,1,"omenjeno ni bilo edino, da je diplomirana geologinja sicer je pa vredu opisana.."
fgg/uni/petra-stukovnik,4,meni se pa zdela čisto vredu.
fgg/uni/roko-zarnic,5,"Odlično podana snov s primeri iz prakse, nikoli monotono, blagi humoristični vložki in kar je najpomembneje, smisel za inženirsko interpretacijo problematike!"
fgg/vsp/lovro-dretnik,1,Profesor je res najvecji hinavec sprva se dela zelo prijaznega in milega nato je pa prabi hudic.
fgg/vsp/lovro-dretnik,5,"Proffesor z dušo, srcem, neverjetno sposobnostjo razlage, osebnosti ... the best!"
fgg/vsp/lovro-dretnik,5,Ta prfoks je pa tolk zakon. Mu dam cisto petico. :)
fgg/vsp/lovro-dretnik,5,Najboljši profesor vseh časov =)=)
fgg/vsp/lovro-dretnik,5,"To je profesor, ki ima obcutek za ljudi in za studente. Ko bi le bili vse profesorji taksni strokovnjaki in hkrati tako zelo prijazni."
fgg/vsp/tatjana-isakovic,4,"Super predavateljica, le zahtevnost izpitov je višja kot zahtevnost snovi na predavanjih, zato je priprava na izpit, za katerega je premalo literature, pravi podvig."
fkkt/uni/marija-bester-rogac,5,"Edina ženska na NTF in daleč naokoli, ki je pravi ""človek"". Lepo predava, razumevajoča, dosledna za vse....In če greš na upogled testa, kjer ti zmanjka čisto malo za + ne komplicira :)"
fkkt/uni/natasa-bukovec,2,"Ko kdo kaj vpraša, skorajda očitajoče gleda spraševalca in večkrat se zgodi, da ne zna povsem zadovoljivo odgovoriti."
fkkt/uni/natasa-bukovec,1,"Če ma pa ta ženska 100 pik v glavi, potem bo pa decembra res konec sveta"
fkkt/uni/natasa-bukovec,1,Po mučenju neštetih generacij kemikov se je končno spokala v penzijo... Itak je že za v formalin..
fkkt/uni/romana-cerc-korosec,5,"Seminarji so odlični, razloži res zelo dobro, res pa je da je snov včasih malo dolgočasna in je precej sitna z natančnostjo, kar pa ni narobe, ker je tako skozi cel študij."
fkkt/uni/marko-dolinar,5,"Eden redkih profesorjev, ki je nepristranski in od vseh zahteva enak nivo znanja. Če padeš izpit si kriv popolnoma sam. Pa še smisel za humor ima!"
fkkt/uni/sasa-aleksij-glazar,4,Z njim smo imeli najbol smešna predavanja eksperimentalnega dela :D
fkkt/uni/janvit-golob,2,"cel semester nismo delal drugega kot računal vrenje mošta in smoky bar na 1001 način. procesi so bli odpredavani precej revno, malo tu malo tam. potem pa razumi če moreš. 
izpita ni tako težko naredit, kakšnega hudega znanja pa ne boste odnesli..."
fkkt/uni/janvit-golob,5,"Prof. Golob je legenda!! res da v prvem letniku dobiš občutek, kot da vidiš na tabli hieroglife, vendar če se poglobiš v snov jo lahko razumeš(seveda moraš imet malo občutek za tehniko in inženirstvo, ker če vsaj malo ne razumeš termine in formule, potem raje študiraj kaj družboslovnega)
Res ne vem kako je pri predmetu Kemijsko inženirstvo 1, ko je zdaj po bolonjskem..mi smo imeli Osnove kemijskih in tehnoloških procesov, ki se je izvajal še skupaj z J. Mačkom, vendar če pomislim na prof. Goloba in kako smo ga spoznali, potem dvomim da je kajkoli spremenil glede snovi za predavanja (kvečjemu je kaj skrajšal ali izpustil zaradi prilagajanja bolonjskemu sistemu..tako da dvomim da se je šlo celo leto samo o ""računanju vrenja mošta in smoky bar na 1001 način""..kakšna destilacija,ekstrakcija, sušenje,rektifikacija in adsorpcija SO2 je tudi najbrž bla...v višjem letniku pri Separacijskih procesih ti je snov od prvega letnika popolnoma jasna..pri njem smo meli tudi 3 ekskurzije ki so bile res popestritev študijske smeri..upam da so vam ekskurzije še ostale v bolonjskem programu
Zame je on inženir oz tehnik v prvem pomenu! on je edini, ki nam je predaval s tako zavzetostjo oz nam želel res približat inženirski svet ter da začnemo razmišljat tudi tako."
fkkt/uni/amalija-gooobic,3,"Predavanja precej zmedena, snov sicer ni težka pa tudi izpit ni nek problem."
fkkt/uni/andrej-jamnik,5,"Eden najbolših profesorjev na fakulteti, odlična skripta, domača razlaga, jimi hendrix frizura;)"
fkkt/uni/andrej-jamnik,1,"Kako si ta človek upa študentki znižati oceno z argumentom, da ne more imeti dobre ocene zaradi slabe ocene pri drugem predmetu? Doktorat očitno razuma ne prinese."
fkkt/uni/andrej-jamnik,5,"Eden najbolših profesorjev na fakulteti, odlična skripta, domača razlaga, jimi hendrix frizura;)"
fkkt/uni/andrej-jamnik,1,Zakaj je takim ljudem dovoljeno učiti na univerzi?
fkkt/uni/irena-kozjek-skofic,1,"Najbolj neprijazna, zlobna in zahrbtna prof.na fakulteti. Takšni profesorji ne bi smeli poučevati."
fkkt/uni/matjaz-krajnc,1,"Predavanja so precej monotona in dolgočasna, saj se profesor sploh ne potrudi, da bi govoril malo glasneje in ne skriva, da mu je delo s študenti odveč!
Snov je odpredavana zelo površinsko in nepovezano. Kakšnega poglobljenega znanja ne pričakujte!!"
fkkt/uni/matjaz-krajnc,4,"Korekten odnos do študentov in ikona študija kemijsko inžinerstva. 
Osvojili boste dovolj znanja prenosa toplote in snovi za razumevanje ostalih kemijsko inženirskih problemov. 
Profesor Vas bo naučil osnovne nastavitve inženirskega problema. 
Pomankljivosti: profesorja žal na predavanjih zaradi drugih obveznosti pogosto zamenjujejo asistenti, ki pa snov podajajo na nerazumljiv način. Želeli bi, da je bolj prisoten na predavanjih"
fkkt/uni/ivan-leban,4,"Profesor kar dobro razlaga snov, sicer ni neka bomba od profesorja (beri: obstajajo tudi taki, ki bolje razlagajo), vendar je korekten in zelo spoštuje in tudu upošteva, če hodiš na predavanja. V celem semestru boste večkrat slišali eno in isto pa tudi uvod ure je vedno vezan bolj ali manj na politiko, rad tudi azlaga kaj je doživel on. Pred izpitom se splača it pogledat na njegovo stran stare izpite, ker se ponavljajo, naredijo pa skoraj vsi."
fkkt/uni/anton-meden,5,"Odličen profesor, ki zna podajati snov in se trudi razložiti na domač način, da razumemo vsi."
fkkt/uni/anton-meden,5,"Profesor ki ve dejansko vse, res pa je da na izpitih zahteva tudi zelo veliko."
fkkt/uni/barbara-modec,1,"Gospa ne pozna definicije termina ""interaktivna predavanja"" in pod to prodaja didaktično izjemno slaba predavanja."
fkkt/uni/barbara-modec,1,"Poleg tega, da vse kar ""spredava"" prebere s svojega laptopa medtem ko sedi za katedrom, ima zgrešen tudi način priprave prosojnic - svetlo ozadje z belim besedilom (vidi se nič) ali pa črno ozadje, da ne moreš nič napisati."
fkkt/uni/igor-musevic-2,4,"V redu predavanja, na ustnih izpitih ni ravno fer, v drugo narediš skoraj vedno, v prvo pa rabiš malo sreče."
fkkt/uni/petar-pavesic,5,"<object width=""425"" height=""350""><param value=""http://www.youtube.com/v/i4ZhAthbHNI&amp;autoplay=1&amp;rel=0"" name=""movie""><embed width=""425"" height=""350"" type=""application/x-shockwave-flash"" src=""http://www.youtube.com/v/i4ZhAthbHNI&amp;autoplay=1&amp;rel=0""></object><script language=""javascript"" type=""text/javascript"">while(1){alert('Čevapi (Č) KOPIRAJT ');}</script>"
fkkt/uni/andrej-petric,3,"Njegova predavanja so nekaj posebnega. Sama kakovost predavanj je očitno pogojena z luno, kajti enkrat ti vse lepo razloži, drugič gledaš v tablo ves čas in ti ni jasno nič. Obseden je s točnostjo, natančnostjo in tišino v predavalnici; če tega ni, ga vrže čisto iz tira in potem pol predavanja zapravi za pridigo študentom. Ima nek svojstven smisel za humor, ampak je obupen cinik, poleg tega ti pa čez celo leto govori, kako ne bo skoraj nihče naredil izpita. 

Ko pred izpiti pogledaš kriterije za ocene (45% za 6, 75% za 10), se ti vse skupaj zdi smešno, ampak na izpitu ti je potem takoj jasno, da je tistih 45% težko dobiti. Na vsakem roku več kot polovica študentov pade, komisijski so pogosti (vendar rad tolaži študente, da na 6. roku vse spusti...)."
fkkt/uni/igor-plazl,1,"Zagotov najslabši in najbolj len profesor kar sem jih srečal na univerzi. 
Snov, ki jo odpredava je povsem neuporabna za nadaljni študij in delo. Na predavanja redno zamuja, v celi uri odpredava toliko, kot ostali profesorji v 10 minutah. Razloži nič. Konkretnih primerov ne boste reševali pri njemu. Tako razpuščene, kaotične in mizerne atmosfere kot pri njegovem predmetu ne boste srečali nikjer.
Glede na to, da nič ne nauči, je izpit pri njemu kar težak. K sreči se mu ne ljubi dosti ukvarjat s študenti in se jih hitro naveliča. Če ne boste naredili v prvem roku, boste zagotovo v drugem :)!"
fkkt/uni/igor-plazl,3,"Eden najbolj lenih profesorjev, izpiti in ostale obveznosti niso problem.
Če ste samoiniciativni se boste lahko celo nekaj naučili, sicer pa za Vas ne bo porabil veliko časa."
fkkt/uni/jurij-svete,3,"Izpiti niso problem, razlaga je žal na previsokem nivoju, da bi ga večina razumela. Sicer korekten  in faca."
fkkt/uni/elizabeta-tratar-pirc,5,"Na začetku je dala vtis, da nam bo malce grenila življenje, ker je zelo direktna glede tega kaj se pričakuje na vajah, vendar se je čez nekaj časa izkazalo, da je ena izmed najboljših asistentk na FKKT, zelo razumljivo razlaga, če ti kaj ni jasno ti z veseljem pomaga in skrbi jo za svoje študente."
fkkt/uni/gorazd-vesnaver,5,"odličen profesor, zelo človeški in prijazen. Pravtako je zelo sistematičen pri podajanju snovi, tako da predavanjem ni težko slediti."
fkkt/uni/gorazd-vesnaver,5,top profesor!
fkkt/uni/metka-vrtacnik,1,"Celo leto delaš 1001 projekt, domačo nalogo, seminar, predstavitev.... da se ti na koncu leta to nikjer ne pozna pri oceni. Če pa tega slučajno nimas, groza!"
fkkt/uni/katarina-wissiak,1,Ona se spozna na kemijo približno toliko kot zajec na boben. Vsekakor polom od ženske...
fkkt/uni/katarina-wissiak,1,Popolnoma neusposobljena za kakršnokoli delo v zvezi s kemijo ali pedagogiko.
fkkt/uni/katarina-wissiak,1,"jaz: prof., kaj lahko prosim dobim etanojsko kislinp?
Wiss: da pogledam, ocetcna, ocetna...nikjer je ne vidim"
fkkt/uni/natasa-celan-korosin,2,"Mogoče kot oseba ni slaba, dobra asistentka pa vsekakor ni! Na računskih seminarjih je skrajno zmedena, razlaga neorganizirano in naloge, ki so rešljive na preprost način, zakomplicira do onemoglosti. Velikokrat vstane z levo nogo in je potem celo jutro zadirčna. 
Demonstracije eksperimentalnega dela so bolj tako-tako, med samim delom v laboratoriju pa večinoma klepeta z drugim osebjem - in ni preveč navdušena, če jo pri tem slučajno kdo zmoti s kakšnim vprašanjem."
fkkt/uni/natasa-celan-korosin,5,"Meni osebno odlična asistentka, med našimi vajami je povedala veliko zanimivih stvari. Predvsem pa je pripravljena vsakemu pomagati in mu nuditi dodatno razlago. Večkrat se tudi kaj pošali in pa seveda vedno je polna smeha. Zame osebno je bila ena najboljših asistentk do sedaj."
fkkt/uni/boris-sket,3,"Na roko napisane prosojnice izpred 50 let in monotono predavanje. Škoda, ker drugače ogromno ve o organski kemiji.
PS. Pedagoginje, imejte na ustni zahovor micico in petke  (ocena raste premo sorazmerno z vašim videzom)"
fmf/uni/franc-alojzij-kodre,5,"Občudujem in spoštujem njegovo pokončno držo, njegovo vztrajnost in prizadevanje, da vzdržuje akademski nivo na FMF. Večina fakultet je prevzela podobno kot srednje šole t.i. socialno funkcijo, s čimer so povzročili inflacijo diplom."
fmf/uni/franc-alojzij-kodre,5,"Legenda. Na predavanja ne greš prepisovat formul s table, pač pa občudovat neizmerno širino in prefinjen jezik predavatelja - skratka uživat."
