
fe/uni/france-mihelic-2,2,"Res dolgočasno predavanje, mi smo imeli ob mislim da ob četrtkih ali petkih ob 7h zjutraj do 10h, obisk porazen, nikakav, pa še tisto ko so pršli so na pol spali. Kar se izpitov tiče povprečno (nič ekstremno še ni blo)."
fe/uni/france-mihelic-2,1,"Predavanja pri zgoraj omenjenemu predmetu so skoraj obupna. Če se prisotnost ne bi beležila bi bil obisk približno ničen. 
Vse, kar je profesor povedal, bi lahko skrčil v tri šolske ure. 
Laboratorijske vaje niso zanimive. Pri govornih tehnologijah smo poslušali predavanje o linuxu, pri slikovnih nismo poslušali, ker asistenta praktično ni bilo v laboratoriju. 
Končna ocena je več ali manj odvisna od doseženih točk iz vaj in kolokvijev. 

Na ustnem izpitu skoraj ne prideš do besede, dobro oceno dobiš samo, če odgovoriš na vprašanje, še preden ti ga prof. zastavi. 

Predmet kot tak je zelo zanimiv. Nezanimivi so ljudje, ki ti podajajo znanje."
fe/uni/damijan-miljavec,5,"eden izmed redkih, ki zna snov razložit na enostaven, predstavljiv način v kmečkem jeziku, brez nepotrebnega balasta in dobro naveže stik s študenti, tako da so predavanja bolj spominjajo na skupinsko delo kot pa poslušanje enega dolgočasneža."
fe/uni/damijan-miljavec,5,"Najbolj zanimiv ustni do sedaj :) (v drugo, seveda) :)"
fe/uni/damijan-miljavec,5,"miljavec ve, kako se rečem streže!"
fe/uni/damijan-miljavec,5,"Najboljši profesor na fakulteti. Razlaga s srcem in zelo razumljivo. Pripravljen je veliko storiti za študente in laboratorij za načrtovanje el. strojev je napolnjen s študenti, ki si želijo znanja. Miljavec pa radodarno z njimi deli znanje in zelo drago opremo."
fe/uni/damijan-miljavec,5,"Če te vsaj približno snov zanima, je to na najlažji način pridobljeno znanje. Če si delaš zapiske sam si zmagal. Pred izpitom sem znal polovico snovi zgolj s spomina s predavanj. Z njegovimi primeri s prakse si snov še lažje zapomniš. Povečanje vpisa na močnostno smer po upokojitvi Lenasija pove svoje.
Na ustnih jasno loči kaj so osnove in kaj je več. Sploh pri El. Meh. pretvornikih v 2. letniku ni nikogar vrgel, ki si tega ne bi zaslužil. Če si vedel značilnost karakteristik in zakaj se vrti je blo večinoma zadosti. Da se slučajno potem ne bi našel elektrotehnik ki bi začel verjti v razne perpetum mobile."
fe/uni/bostjan-murovec,3,"Predavanja so izvrstna.
Opravljanje izpita in ocenjevanje katastrofa, razen ce imas sreco in ima dober dan lahko dobis dobro oceno, ali pa ce se mu na laboratorisjkih prisesas tako kot nakateri njegovi ljubljencki."
fe/uni/bostjan-murovec,2,"hodil na predavanja, veliko pobereš iz samega predavanja (tako študijsko snov, kot življenjske stvari).
negativna ocena pa leti na povzdigovanje nad študente in občutek, da si totalen nevednež (to se ne tiče tega, da mu lahko rečeš kar Boštjan in ne prof. mag. dr. g. ga. Boštjan Murovec, to je stvar avtoritete in ne direktnega odnosa do študentov). 
ne motijo me ustni ali pisni izpiti, tako pač je, snov je potrebno znat. boštjan vem, da poznaš/obvladaš stavari, ampak ali je to potrebno pokazati na tak način?
verjamam pa tudi, da je za dvig povprečja na tej strani krivo tudi pihanje na dušo profesorju v upanju na kakšen plus pri osebnostni analizi študenta iz strani profesorja (to ne leti na anonimneže, ampak na tiste, ki potem javno na študentski grupi objavijo, da so mu dodelili dobro oceno). pa smo trčili na realna tla :)
Dolinar je odličen profesor, ima relativno težke ustne/pisne izpite ampak njegov odnos do študentov je ZELO drugačen (kot primerjava za komentar profesorja murovca iz grupe avtomatikov 2009)"
fe/uni/bostjan-murovec,5,"+ : vsako stvar ti bo razložil na nešteto različnih načinov, da ti bo jasna
- : skače iz ene snovi k drugi"
fe/uni/bostjan-murovec,3,"trošenje in izražanje svojih mnenj je nekaj čemur je ta stran namenjena.
zdi se mi neumno da prof. murovec poskuša umetno vzdigovat publiciteto s pozivanjem grupe da glasujejo zanj.....get a life.
moj komentar je da sem videl že boljša in slabša predavanja tako da je za mene nekje v povprečju(3/5),ocenjevanje pa tudi tu nekje,je pa res da imam narejeno ie1,ie2 pa naj bi bila težja tako da glede ocenjevanja težko rečem.
ne vem koliko je to pomembno ampak jaz sem dobil par dokaj osnovnih vprašanj medtem ko je sošolec dobil bolj zahetvna naredila sva pa oba(on v drugo).
prosim da se vzdržite neumnih in nevmesnih komentarjev."
fe/uni/bostjan-murovec,4,"""Ok, ja, res je, kdor se mi na lab. vajah prisesa, je drugace obravnavan. 
Takoj podpisem. In meni se to ne zdi ni narobe.""
Skoraj nisem mogel verjeti izjavi,ker sem si vas predstavljal drugace.Pri meni ste izgubili vso kredibilnost kako vrednotite znanje, obravnavati bi morali samo izključno koliko študent zna ne pa kakšen je."
fe/uni/bostjan-murovec,2,"O njemu bi vsak lahko napisal roman. Po moje bolje se trudi bolje hoče imeti interkativnosti (feedback) od študentov kakšen je on profesor, slabše je za vse skupaj za njega in študente. včasih se mi zdi da tole gre preveč od relacije študent-profesor, tudi profesor mora kdaj udariti po mizi in reči take je situacije tako bo in tako je in pika. Kar je njega tiče on trka po mizi noče pa udart. Mislim da se še išče kot profesor v psihološkem smislu, kar študenti nevejo oz nevedo kako bi njim in majo različna mnenja, kar posledično dajejo različne feedbacke profesorju, kar spet privede v zanko čudnih odnosov.
Ker vedno bodo študenti, ki hvalijo profesorja, in vedno bodo študenti ki ga nehvalijo, to je na vsaki šoli vsakem faksu. nemoreš vsem ugoditi to je dejstvo, kar je pomembno je tisto kar misli večina in povprečni študenti o vsem skupaj. 
Včasih res nevem kaj se z nim dogaja, včasih te ma ta totalnega kret..., včasih pa za dokaj normalno pametno osebo. 
Ampak bistvo je da on tam pove/razlaga/poučuje o elektroniki, hkrati pa tudi v elektroniki v sve splošnem znanju (npr. je koristno, kje, kdaj, zakaj, ....), kar je dobro za študente. 
Dejstvo je pa tudi študenti iščem bližnjice kako čimprej pa čimlažje čez tale izpit."
fe/uni/bostjan-murovec,3,"Murovec je človek z zavidljivim znanjem, ki ga zna tudi precej uspešno deliti s študenti. Vse kar uči ima nek namen; idealna vezja predava samo zato, da lahko nato razlaga težave realnih vezij in tako dalje. Študentom zares poskuša v enem letu (IE1, IE2) podati osnovno znanje ind. elektronike.

Po drugi strani je profesor ciničen, ima zelo negativen odnos do vsega in na splošno daje občutek da mu je vse skupaj odveč, ker ve, da je tudi študentom vse odveč. Pa dajte no, marsikdaj me je predavanje zagrabilo ampak me je ta odnos odbijal.

Na izpitu ni preveč zahteven, je pa res, da sem se njegova predmeta učil ""kot budala"". 

Še ta cvetka:
Na začetku zagovora IE2 mi je povedal, da mu je še vedno žal, ker mi je za IE1 dal dobro oceno... je res potrebna vsa ta negativna energija?"
fe/uni/bostjan-murovec,4,"Predavanja so zelo koristna in poučna, tudi večina laboratorijskih vaj je zelo dobrih. Na kolokvijih je občasno preveč podrobnosti, za katere sploh ne izvemo. Ustni izpit pa je res odvisen od dneva."
fe/uni/bostjan-murovec,2,"Žalostno je da sem se sam moral pošteno namatrat, da sem se naučil snov, in z veliko hecanja v glavo komaj dobil 6, po moje sem si zaslužil več vendar pustimo to, sedaj pa srečam sošolca ki je opravljal industijsko elektroniko in pravi, da se vse spušča skozi, tudi največji luftarji dobijo 6 mislim wtf. Žaslostno Boštjan od mene si izgubil kar nekaj spoštovanja."
fe/uni/bostjan-murovec,5,"Profesor v pedagoško dejavnost usmerja veliko truda in želi, da bi čimveč odnesli za življenje.
Sedaj lahko rečem, da sem elektrotehnik."
fe/uni/bostjan-murovec,4,"Odlično podajanje snovi, primeri, analogije, življenjsko učenje. Sam odnos študent-profesor je bil zastavljen dobro, v smislu, da je profesor prijazen in načeloma dostopen, vendar je velikokrat prišlo do efekta ničvrednosti. Ko profesor govori o svojem prvem vezju, ki ga je naredil pri 8ih letih, se človek počuti bolj kot ne zelo zabito, ker je on pač pri 8ih igral rač. igrice ali metal žogo v koš. To zelo vpliva na to, ali bo študent sploh pristopil do profesorja, ker se mu zdi neumno spraševati o banalnih problemih, ko npr. ne razume neke malenkosti pri operacijskem ojačevalniku.
Druga stvar, ki me je zmotila, pa so bili stvari, ki so sicer bile zelo oči-odpirajoče, ampak so izpadle pesimistično. To da profesor na predvečer kolokvija pošlje povezavo do članka, ki opisuje kako so Kitajci superiorni že skoraj v vsem kar delajo in da je sploh brezveze študirat, ne pomaga ravno pri motivaciji.

Overall profesor se res trudi, da bi študente nekaj naučil in tudi že to, da na mailing grupo pošlje prošnjo za ocenitev na tem portalu, je en velik plus in korak k izboljšanju odnosa preko povratne informacije."
fe/uni/bostjan-murovec,5,"Predavanja so zanimiva, opremljena z EPP-ji v obliki datasheetov. Veliko real life ugank se mi je razrešilo na njegovih predavanjih, pa tudi datasheetov me ni več strah."
fe/uni/bostjan-murovec,2,"Jaz nevem zakaj je take štala okoli njega. Imel me je IEL2 in me je 1 ruknu na izpitu, drugič sem naredu, mal je jamral da je moje znanje ni super. Drugače pa nič posebnega. Včasih mal pojmra to pa je to."
fe/uni/bostjan-murovec,5,"zelo veliko se odnese s predavanj, predvsem se naučimo razmišljati kot elektroniki, nevem kakšne probleme mate vsi z njegovim odnosom, mogoče vas oči pa mami nista zadost mela rada, kolokviji so po svoje zajebani ker je treba razmišljat s svojo glavo po svoje pa lahki, ker je samo treba pokazat razumevanje in če hodiš na predavanja in dejansko poslušaš in razmišljaš (kar zna včasih biti težko, še posebi če si mogu prej tri ure poslušat uspavanko (modeliranje procesov)) se ni problema naučit za kolokvije, zapiski so obsežni in mislim da se je lažje učiti iz njih kot iz kakšne knjige, laboratorijske vaje so vredu izvedene, edino pripombo imam na demonstracijske vaje, preveč so dolgočasne, nič ne odnesem od njih, ne da se mi 2 uri stat v tisti vročini, pa še poročil ne znam napisat ker ne vem kaj smo delal, ampak to je bolj moj problem, osebno bi raje videl da pri vseh vajah delamo samostojno, zdej za ustne pa ne vem, verjetno znajo bit težki če nimaš pojma"
fe/uni/bostjan-murovec,5,fuul kul
fe/uni/bostjan-murovec,5,"Meni se zdi super profesor, žal pa je v realnosti tako, da če študent dobi slabo oceno (krivda je v veliki večini primerov na njemu), je vedno kriv profesor in so potem pripombe v smislu, da me je hotel zafktniti, znal sem dovolj - a nisem dobil pravilne ocene,...
Na predavanjih se odnese ogromno, mogoče je res da malo skače, vendar na ta način dobiš ogromno dodatnih znanj, ki nam morda pridejo enkrat v življenju prav.
Z ustnimi izpiti imam tudi dobre izkušnje (res pa je, da sem se dobro naučil :))."
fe/uni/bostjan-murovec,4,"Obup... ne vem s cim imate tezave, vendar namesto, da trosite cas na tem portalu, raje studirajte in tezave s profesorji bodo kar naenkrat manjse!!!

lp"
fe/uni/bostjan-murovec,1,ela boštjan ja imam  velikoga i ja bi instrukcije iz industrijsku elektroniku pa ak biš mi mogao pokazati tvoju formulu za otpor
fe/uni/david-nedeljkovic,5,"Največji car, še posebej kot mentor pri diplomi! Vsekakor priporočam!"
fe/uni/david-nedeljkovic,5,"največji car! v teoriji rad regulira, hkrati pa tudi digitalno krmili!"
fe/uni/david-nedeljkovic,5,dobro krmili in še boljše regulira!
fe/uni/david-nedeljkovic,1,"Ne vem zakaj, ampak nažalost v študentih vedno išče napake in neznanje. Zakaj nimam pojma. Seveda je on profesor in ve dosti več kot jaz in bo vsakič lahko našel nekaj kar ne vem in nato se bo vse vrtelo okoli tega dokljer ne bom ponovno ruknil...
škoda, slišal sem že veliko pozitivnih stvari o nejm, sploh kot mentorju, vendar nažalost moja ocena vsaj do sedaj ni ravno visoka."
fe/uni/milos-pantos,4,"V čem je fora? Fora je u tem da...

...a dinamiko ste že imel?"
fe/uni/milos-pantos,5,"Na predavanjih snov hitro predela, ustavi se na pomembnejših podrobnostih. Včasih razloži kakšno stvar, ki je ne bi bilo treba. 
Uspešno podaja primere iz (lastne) prakse. Človeški profesor, ki ne ve odgovorov na vsa vprašanja, vendar zadeve obvlada.
Posveti se tudi posameznemu študentu (če ima študent interes), vendar težko najde čas zaradi zaposlenosti.
Drugače je pa zabaven profesor :)"
fe/uni/milos-pantos,4,"mnenja(kvaliteta, izpiti)?"
fe/uni/igor-papic,5,Fer do študentov? DA(se strinjam)/NE(ne strinjam)
fe/uni/igor-papic,5,"Jaz pa rada hodim na njegova predavanja. Dolgočasna? Ne. Občasno pove kaj smešnega v zvezi z ""zelenimi"", težave energetikov na slovenskem politično-gospodarskem parketu in drugod po svetu, kakšne anekdote, fore ali lastne izkušnje. Mogoče dolgočasna zaradi večinoma istega tona, ampak to do zdaj mene ni motilo. Vsebino literature lepo zaokroži in razloži. Nimam pripomb."
fe/uni/igor-papic,4,"Predavanja nekoliko dolgočasna, drugače pa zelo fer do študentov. Kr tako naprej!"
fe/uni/samo-penic,5,"Asistent Samo Penič je po mojem mnenju najboljši asisten za OET v prvem letniku. Če česa ne znaš, si vedno vzame čas zate, ti kaj še dodatno razloži oziroma pove, kam poglej, da boš svoje znanje poglobil."
fe/uni/andrej-perne,4,"Kar v redu asistent, obnovi snov z predavanj, nato pa začne z reševanjem primerov. Pa zelo uporabno skripto ima na netu."
fe/uni/andrej-perne,4,"Zelo dober in preprost asistent. Vaje rešujejo študentje na tablo, vendar tako, da vsi v predavalnici vedo kaj se dela. Od njegovih ur sem veliko odnesel.
Za konec pa še njegov citat o kalkulatorju: ""Kalkulator je za slabiče!"""
fe/uni/andrej-perne,5,Andrej Perne je Harry Potter matematike.
fe/uni/andrej-perne,5,""" Kalkulator je za slabiče "" se spomnem ja, edino lani mu je ušlo, ko je rekel "" z eno muho smo ubili dva maha "" drugače zna razlagati, jaz osebno sem veliko odnesel, 1A"
fe/uni/andrej-perne,5,"Definitivno najboljši asistent za matematiko. Ima ogromno znanja, ki ga zna odlično širiti med študente na vajah. Z njegovih ur boste odnesli ogromno."
fe/uni/andrej-perne,5,"če se pr nemu ne bote naučil se ne bote nikjer, hvala za razumevanje 

ars"
fe/uni/andrej-perne,5,Legenda-tip
fe/uni/franjo-pernus,4,"Profesor Pernuš je vedno urejen in daje vtis močne avtoritete. Njegova predavanja so jasna in jedrnata, slediti jim ni težko in tudi delati zapiske ni problematično, saj vedno nakaže, kaj je pomembno in vredno zapomnit si. Tu pa tam se malo razgovori o splošnem (ne)znanju novejših generacij in grozi s kitajsko invazijo elektroinženirjev na evropo, s čimer v predavalnici ustvari bolj ali manj klavrno vzdušje, to pa je po mojem tudi edini minus njegovih predavanj. Pisni izpit je dokaj zahteven, še posebej zaradi pravila ene naloge rešene v celoti, a se z malo več truda tudi to da naredit. Na ustnem izpitu je korekten, da ti čas za razmilek in te po potrebi tudi malo usmeri na pravo pot do pravilnega odgovora.
Skupna ocena: 4"
fe/uni/franjo-pernus,4,"Mene je imel kar nekaj časa nazaj teorija vezij in sistemov, vsako leto govor o teh indijskih in kitajskih študentov, kar se tiče je kar cool, včasih strog, včasih mal popusti. Izpit ni težak, če se naučiš dober ta izpit, ti bo pomagalo pri vseh nadaljih izpiti ker tle so neaktere osnove za nadalje izpite, sej meni je."
fe/uni/franjo-pernus,4,"Ja res več govori od invaziji tujih elektroinžinerjev, ampak ne samo o kitajskij tudi od indijskih, ...... 
Predavnja cool, zapiski so dobri pri njem, izpit se pa tudi da narediti z lahkoto če sem mal usedeš za 1 teden pa narediš par vaj, ugotoviš da je kar lahka snov, pa tudi dost zapiskov in starih izpitov na netu!"
fe/uni/matija-pirc-2,3,"Asistent je indijanec. Predvideva se, da v svojem kabinetu kliče dež. To seveda ni zaželjeno, saj Sinigoj ob slabem vremenu na ustnem izpitu, kandidate zelo rad vrže."
fe/uni/matija-pirc-2,5,"Včasih je bil asistent pri predmetu elektronske komponente, kjer je zadeve zelo lepo razložil. Je pravi naslov za mikrokontrolerje PIC in teme o modelarstvu."
fe/uni/stanislav-rebersek,5,"Dolgočasen profesor, predava pa snov ki je zelo pomembna za elektrotehnike, ni pa najlepša"
fe/uni/stanislav-rebersek,1,No comment...žal ne najdem niti ene svetle točke..
fe/uni/stanislav-rebersek,1,Bogi no
fe/uni/mitja-rup,3,Prijel se ga je nov vzedevek: SNIPER
fe/uni/mitja-rup,2,"Mislim, da ne vodi nobenih vaj ali predavanj. Prisoten je le kot nadzornik ob pisanju izpitov energetske katedre. Od tod mu tudi vzdevek - Sokolje oko."
fe/uni/dragan-savic,1,"Znjim se da vse zment skos ze za**bava, je pa popolnoma nesposoben kot predavatelj. 

Tipičen pogovor.
Savič:kako se to nardi?
student: nevem.
Savič: Kako neveš???
(Savič pogleda na svoj list, si pogleda kako se naredi)
Savič: a vidš to se tko naredi,(in prepiše z lista)."
fe/uni/dragan-savic,1,"Anti-pedagog! Sploh ne razlaga snovi in nalog, ampak samo prepisuje iz svojega lista na tablo. 100 krat se zmoti in očitno je, da ne obvlada snovi kot bi jo moral."
fe/uni/dragan-savic,5,Legenda! sploh pa v tandemu z Dušanom :)
fe/uni/sinigoj,5,z lepimi pozdravi ars
fe/uni/sinigoj,3,Hočem nazaj 8000 SIT za uno njegovo biblijo!
fe/uni/sinigoj,5,"Človek si le lahko želi še več takih profesorjev. Veliko ljudi se spotika, češ ""na izpitu me je zafrkaval"" in podobno. Ampak dejstvo je, da tisti, ki so dobro odpisali pisni del in se dobro pripravili na ustni del, z njim niso imeli ""težav"". Ostalim pa zna življenje pošetno zagrenit. Tako je tudi pošteno! Če ima redno po večkrat na teden predavanja, je pravilno, da se od študentov toliko tudi zahteva! Konec koncev študiraš elektrotehniko. Če je ne boš znal ti, kdo jo bo...?"
fe/uni/sinigoj,4,"ma svoje fore. na kolokvijih, ko maš za obkrožit, maš vse možnosti 'če se učenec zmoti' med rezultati"
fe/uni/sinigoj,5,"Predavanja zelo dobro razložena, knjiga je dobro spisana, skratka kvaliteten profesor, želim si da bi bilo več takih."
fe/uni/sinigoj,5,"On je izredno izobražen mož! V resnici je fizik. Njegova učbenika sta izvedensko napisana. Razlaga je dobra. 
Kdor meni, da je predmet ""brez uporabne vrednosti"" pojma nima, kaj išče na univerzi. Ta človek uči znanost, ne kuharske recepte!!"
fe/uni/sinigoj,5,"Če na ustnem izpitu znaš dobro in ne ""cincaš"", boš odkorakal z lepo oceno. Če ne znaš in pri ustnem izpitu uporabljaš polno mašil, bo pa cel svet moral poslušat, kako te je ""zaj*bal"".

Predavanja ima tudi kar kul, precej strokovno podaja snov in občasno zna študente tudi nasmejat."
fe/uni/sinigoj,3,ni hud tuner
fe/uni/sinigoj,5,"Meni je reku, da ne znam govort, pa me je padu na izpitu. Sam mu dam petko, ka dobr razlaga, pa kul biblijo je napisu ;)"
fe/uni/sinigoj,2,"po tehnični strani je zelo dober, po pedagoški strani pa obupno slab"
fe/uni/sinigoj,4,"Potrudi se za študente, razloži snov, ki pa ni lahka. Razlago lažje spremljaš, če obvladaš matematiko. S svojimi pripombami zna nasmejati predavalnico. Ne mara prilizovanja. Izpiti/kolokviji realno preverijo znanje. Edina slabost so ustni izpiti kjer je vse odvisno od tega (oz. vsaj dobiš tak občutek) ali ima dober dan! Snov boste bolje razumeli če si pred predavanji pogledate videe. Biblija je uporabna, ni pa poceni..."
fe/uni/sinigoj,1,"Na ustnem avtomatsko zabrisal prijatelja iz razloga, da je predhodnik samo testiral kakšne volje je on danes.

Predavanja so za umret dolgočasna, snov nezanimiva.

Predmet ni vreden časa, ki ga zanj porabiš niti nima uporabne vrednosti."
fe/uni/slivnik-2,1,"Prav gotovo intelektualno sposobna osebnost. Kot pedagog totalna ničla. 

Trije doktorati in tri ločitve...

Neprimeren kot profesor!"
fe/uni/slivnik-2,1,"Vzvišen, samovšečen, slab profesor. Povdarja nepomembne stvari na predavanjih, potem pa na izpitu dobiš vprašanje iz snovi, ki jo je nekako skoraj mimogrede omenil. Na izpitu ti ne pove kaj si narobe naredil in kaj je prav. Če ga pa vprašaš pa začne z nekimi svojimi forami...zelo zatežen karakter...
Za njega si samo del statistike."
fe/uni/slivnik-2,3,"Predavanja sama so kvalitetna kar se tiče (večine) obrazložitev. Na žalost (gledano z moje strani) je problem pri pisanju na tablo, saj se skače kar iz ene na drugo stvar.
Prav tako bi lahko ustne izpite malo preuredil, da bi malo razbremenil tako sebe, kot studente.
Kakor pa sem rekel, je z mojega stališča razlaga dobra."
fe/uni/slivnik-2,1,Profesor ki mi je zagrenil življenje
fe/uni/slivnik-2,4,Stari dobri profesor.
fe/uni/slivnik-2,2,Jaz sem z matamatiko naredil na januarskem. Mi je pa pri numeričnih zaradi napačnega datuma prijave pred nosom vrgel uspešno upravljen izpit in rekel zame to ne velja niste prijavljeni. Iščemo birokratsko rešitev ali opravljen izit
fe/uni/slivnik-2,5,"Ma Slivnik je legenda!!!  
Zahteva veliko ampak ima prav sej inženir ne more bit teleban!"
fe/uni/slivnik-2,5,"En izmed boljšh profesorjev. Obvlada snov, ampak zahteva veliko in njegove predmete težko narediš brez učenja in s plonkanjem, kot se da to pri veliko drugih. Tako da ga najbolj opravljajo ravno tisti, ki niso sposobni narediti njegovih predmetov, ker pač ni vsak človek dovolj zrel za faks."
fe/uni/slivnik-2,4,"O njem si večina ustvar negativno mnenje še predn pridejo do prvega ustnega izpita, ker jim zafrustrirani študenti, ki niso naredili eno od Matematik, ki jih ima prof. Slivnik, natvezijo razne zgodbice. Res je, da rajše vidi, da prideš na ustnega s kolokviji, kot pa z izpitom, ni pa spet terorist"
fe/uni/franc-smole,5,Pred leti je bil Smole med bolje ocenjevanimi profesorji. Na predavanjih ni bral iz knjige. Mitto se je vpisal na Fakulteto za elektrotehniko leta 2004. Kot vem mu do diplome manjka še kakih 15 izpitov. Verjetno je tudi Smoletu malo težje sledil.
fe/uni/franc-smole,3,"Smole. Res je dolgčasen bere iz knjige ..... pozna se obiskanost predvanj (včasih porazno), mislim da je najbolj prijazen profesor mislim da tudi včasih preveč popusti študentom. Če se potrudiš za izpit hodiš na vaje in predavanje neboš imel problemov."
fe/uni/franc-smole,2,"Žal nima dobrih pedagoških lastnosti. Branje iz knjige je za knjižnjico, ne predavanja.
Je pa z vprašanji lahko drugače."
fe/uni/franc-smole,2,"Sicer izjemno prijazen profesor, na ustnih izpitih se res trudi da bi iz tebe izvlekel znanje. Je pa res, da so predavanja na smrt dolgočasna in je pravi izziv, da ostaneš buden."
fe/uni/franc-smole,5,"No, mislim, da se tega ne da drugače razložit..."
fe/uni/stanovnik,5,"Stanovnik je res legenda in se potrud, da bi študentom fiziko približal na tak logičen po kmečki pameti način. Vsekakor ima najbolj pregledne in razumljivo napisane skripte za fiziko 1 in 2. Svaka mu čast za literaturo, ki jo je napisal za študente.

P.S. Priporočljivo je, da se hodi na predavanja, ker je posledično tudi lažje narediti ustni izpit..."
fe/uni/stanovnik,5,"Profesor je že malo v letih pa še vedno razlaga z vnemo in veseljem. Poleg enačb in razlage na predavanjih pokaže tudi razne zanimive poskuse, ima odlično literaturo, je vedno na voljo, je človeški tudi na ustnem.. mislim, kapo dol"
fe/uni/stanovnik,4,"Je kar dober profesor, predavanja so zanima, pove kako zanimov info na predavanjih o fiziki, ja kar cool."
fe/uni/stanovnik,5,"Predaval je odlično, sem se pa bal k njemu na ustni, ker so me strašili, da je bolj zahteven od Igliča in da zdaj sem ga pa ""nasankal"", ker bom pri njemu opravljal ustnega. Ampak bil sem prijetno presenečen, na ustnem je bil zelo pošten, začel je pri osnovnih vprašanjih, na katera bi moral znati odgovoriti vsak, ki je bil vsaj malo na predavanjih in ni zraven spal. Čeprav priznam, da mi je bila fizika vedno zanimiva (tudi na srednji šoli), bi po mojem njegova predavanja za fiziko navdušila tudi marsikaterega študenta s kakega družboslovnega faksa."
fe/uni/jurij-tasic,1,On je to stran imel že leta 1976 v LDOS-u!
fe/uni/jurij-tasic,1,"Mislim, da od leta 1980 dalje ni napredoval. Zato se skriva za profesorsko vzvišenostjo in poizkuša snov čim bolj zamegliti, da ga mi ne bi s svojimi vprašanji mogli razkrinkati.
Na izpitu je tudi nekonsistenten, enemu kolegu je enkrat celo šenkal oceno brez vprašanj, druge nas pa muči. A je to pošteno?"
fe/uni/jurij-tasic,3,"Žal ne nauči nič uporabnega, bolj ali manj tava v svojem svetu matric in fazorjev.
Je pa vsaj razumen in pošten."
fe/uni/jurij-tasic,1,Na žalost moje znanje presega njegovega in je bilo precej težko se vzdržati komentarjev pri predavanjih .. Nazalost nas sistem ne dopusca zamenjave takih dinozavrov.
